"No.","Time","Source","Destination","Protocol","Length","Info"
"1","0.000000000","10.0.0.1","10.0.0.2","TCP","74","52142  >  34567 [SYN] Seq=0 Win=29200 Len=0 MSS=1460 SACK_PERM=1 TSval=1358909 TSecr=0 WS=512"
"2","0.153137104","10.0.0.2","10.0.0.1","TCP","74","34567  >  52142 [SYN, ACK] Seq=0 Ack=1 Win=28960 Len=0 MSS=1460 SACK_PERM=1 TSval=1358935 TSecr=1358909 WS=512"
"3","0.217003112","10.0.0.1","10.0.0.2","TCP","1514","[TCP Previous segment not captured] 52142  >  34567 [ACK] Seq=2049 Ack=1 Win=29696 Len=1448 TSval=1358961 TSecr=1358935"
"4","0.227892905","10.0.0.1","10.0.0.2","TCP","1514","52142  >  34567 [ACK] Seq=3497 Ack=1 Win=29696 Len=1448 TSval=1358961 TSecr=1358935"
"5","0.252309893","10.0.0.1","10.0.0.2","TCP","2962","52142  >  34567 [ACK] Seq=4945 Ack=1 Win=29696 Len=2896 TSval=1358961 TSecr=1358935"
"6","0.264398602","10.0.0.1","10.0.0.2","TCP","1514","52142  >  34567 [ACK] Seq=7841 Ack=1 Win=29696 Len=1448 TSval=1358961 TSecr=1358935"
"7","0.288967248","10.0.0.1","10.0.0.2","TCP","2962","52142  >  34567 [ACK] Seq=9289 Ack=1 Win=29696 Len=2896 TSval=1358961 TSecr=1358935"
"8","0.301895780","10.0.0.1","10.0.0.2","TCP","1514","52142  >  34567 [ACK] Seq=12185 Ack=1 Win=29696 Len=1448 TSval=1358961 TSecr=1358935"
"9","0.369587229","10.0.0.2","10.0.0.1","TCP","78","[TCP Window Update] 34567  >  52142 [ACK] Seq=1 Ack=1 Win=32256 Len=0 TSval=1358989 TSecr=1358909 SLE=2049 SRE=3497"
"10","0.382105322","10.0.0.2","10.0.0.1","TCP","78","[TCP Window Update] 34567  >  52142 [ACK] Seq=1 Ack=1 Win=34816 Len=0 TSval=1358992 TSecr=1358909 SLE=2049 SRE=4945"
"11","0.403456828","10.0.0.2","10.0.0.1","TCP","78","[TCP Window Update] 34567  >  52142 [ACK] Seq=1 Ack=1 Win=40960 Len=0 TSval=1358998 TSecr=1358909 SLE=2049 SRE=7841"
"12","0.415023527","10.0.0.2","10.0.0.1","TCP","78","[TCP Window Update] 34567  >  52142 [ACK] Seq=1 Ack=1 Win=43520 Len=0 TSval=1359001 TSecr=1358909 SLE=2049 SRE=9289"
"13","0.432836751","10.0.0.1","10.0.0.2","TCP","1514","52142  >  34567 [ACK] Seq=13633 Ack=1 Win=29696 Len=1448 TSval=1359015 TSecr=1358989"
"14","0.445682895","10.0.0.1","10.0.0.2","TCP","1514","[TCP Out-Of-Order] 52142  >  34567 [ACK] Seq=1 Ack=1 Win=29696 Len=1448 TSval=1359018 TSecr=1358992"
"15","0.445679939","10.0.0.2","10.0.0.1","TCP","78","[TCP Window Update] 34567  >  52142 [ACK] Seq=1 Ack=1 Win=49664 Len=0 TSval=1359007 TSecr=1358909 SLE=2049 SRE=12185"
"16","0.455315212","10.0.0.2","10.0.0.1","TCP","78","[TCP Window Update] 34567  >  52142 [ACK] Seq=1 Ack=1 Win=52224 Len=0 TSval=1359010 TSecr=1358909 SLE=2049 SRE=13633"
"17","0.459009907","10.0.0.1","10.0.0.2","TCP","666","[TCP Out-Of-Order] 52142  >  34567 [PSH, ACK] Seq=1449 Ack=1 Win=29696 Len=600 TSval=1359023 TSecr=1358998"
"18","0.477622388","10.0.0.1","10.0.0.2","TCP","1514","52142  >  34567 [ACK] Seq=15081 Ack=1 Win=29696 Len=1448 TSval=1359026 TSecr=1359001"
"19","0.521358903","10.0.0.1","10.0.0.2","TCP","2962","52142  >  34567 [ACK] Seq=16529 Ack=1 Win=29696 Len=2896 TSval=1359034 TSecr=1359007"
"20","0.533012809","10.0.0.1","10.0.0.2","TCP","1514","52142  >  34567 [ACK] Seq=19425 Ack=1 Win=29696 Len=1448 TSval=1359036 TSecr=1359010"
"21","0.591612968","10.0.0.2","10.0.0.1","TCP","78","[TCP Window Update] 34567  >  52142 [ACK] Seq=1 Ack=1 Win=55296 Len=0 TSval=1359043 TSecr=1358909 SLE=2049 SRE=15081"
"22","0.602632739","10.0.0.2","10.0.0.1","TCP","78","34567  >  52142 [ACK] Seq=1 Ack=1449 Win=58368 Len=0 TSval=1359047 TSecr=1359018 SLE=2049 SRE=15081"
"23","0.611723329","10.0.0.2","10.0.0.1","TCP","66","34567  >  52142 [ACK] Seq=1 Ack=15081 Win=60928 Len=0 TSval=1359050 TSecr=1359023"
"24","0.629732051","10.0.0.2","10.0.0.1","TCP","66","34567  >  52142 [ACK] Seq=1 Ack=16529 Win=64000 Len=0 TSval=1359054 TSecr=1359026"
"25","0.654869598","10.0.0.1","10.0.0.2","TCP","1514","52142  >  34567 [ACK] Seq=20873 Ack=1 Win=29696 Len=1448 TSval=1359070 TSecr=1359043"
"26","0.666457317","10.0.0.1","10.0.0.2","TCP","1514","52142  >  34567 [ACK] Seq=22321 Ack=1 Win=29696 Len=1448 TSval=1359073 TSecr=1359047"
"27","0.677610783","10.0.0.2","10.0.0.1","TCP","66","34567  >  52142 [ACK] Seq=1 Ack=19425 Win=69632 Len=0 TSval=1359066 TSecr=1359034"
"28","0.686762360","10.0.0.2","10.0.0.1","TCP","66","34567  >  52142 [ACK] Seq=1 Ack=20873 Win=72704 Len=0 TSval=1359069 TSecr=1359036"
"29","0.754079913","10.0.0.1","10.0.0.2","TCP","2962","[TCP Previous segment not captured] 52142  >  34567 [ACK] Seq=28113 Ack=1 Win=29696 Len=2896 TSval=1359092 TSecr=1359066"
"30","0.765982040","10.0.0.1","10.0.0.2","TCP","1514","52142  >  34567 [ACK] Seq=31009 Ack=1 Win=29696 Len=1448 TSval=1359094 TSecr=1359069"
"31","0.811322404","10.0.0.2","10.0.0.1","TCP","66","34567  >  52142 [ACK] Seq=1 Ack=22321 Win=75776 Len=0 TSval=1359099 TSecr=1359070"
"32","0.818655556","10.0.0.2","10.0.0.1","TCP","66","34567  >  52142 [ACK] Seq=1 Ack=23769 Win=78336 Len=0 TSval=1359102 TSecr=1359073"
"33","0.894741148","10.0.0.1","10.0.0.2","TCP","2962","52142  >  34567 [ACK] Seq=32457 Ack=1 Win=29696 Len=2896 TSval=1359125 TSecr=1359099"
"34","0.904924030","10.0.0.1","10.0.0.2","TCP","1514","52142  >  34567 [ACK] Seq=35353 Ack=1 Win=29696 Len=1448 TSval=1359127 TSecr=1359102"
"35","0.915426191","10.0.0.2","10.0.0.1","TCP","78","[TCP Window Update] 34567  >  52142 [ACK] Seq=1 Ack=23769 Win=84480 Len=0 TSval=1359123 TSecr=1359073 SLE=28113 SRE=31009"
"36","0.921984363","10.0.0.2","10.0.0.1","TCP","78","[TCP Window Update] 34567  >  52142 [ACK] Seq=1 Ack=23769 Win=87040 Len=0 TSval=1359126 TSecr=1359073 SLE=28113 SRE=32457"
"37","0.978079312","10.0.0.1","10.0.0.2","TCP","1514","[TCP Out-Of-Order] 52142  >  34567 [ACK] Seq=23769 Ack=1 Win=29696 Len=1448 TSval=1359151 TSecr=1359123"
"38","0.990940589","10.0.0.1","10.0.0.2","TCP","1514","[TCP Out-Of-Order] 52142  >  34567 [ACK] Seq=25217 Ack=1 Win=29696 Len=1448 TSval=1359153 TSecr=1359126"
"39","1.048591825","10.0.0.2","10.0.0.1","TCP","78","[TCP Window Update] 34567  >  52142 [ACK] Seq=1 Ack=23769 Win=92672 Len=0 TSval=1359159 TSecr=1359073 SLE=28113 SRE=35353"
"40","1.062235906","10.0.0.2","10.0.0.1","TCP","78","[TCP Window Update] 34567  >  52142 [ACK] Seq=1 Ack=23769 Win=95744 Len=0 TSval=1359162 TSecr=1359073 SLE=28113 SRE=36801"
"41","1.111520197","10.0.0.1","10.0.0.2","TCP","1514","52142  >  34567 [ACK] Seq=36801 Ack=1 Win=29696 Len=1448 TSval=1359184 TSecr=1359159"
"42","1.124912772","10.0.0.1","10.0.0.2","TCP","1514","52142  >  34567 [ACK] Seq=38249 Ack=1 Win=29696 Len=1448 TSval=1359188 TSecr=1359162"
"43","1.129303037","10.0.0.2","10.0.0.1","TCP","78","34567  >  52142 [ACK] Seq=1 Ack=25217 Win=98816 Len=0 TSval=1359179 TSecr=1359151 SLE=28113 SRE=36801"
"44","1.143077434","10.0.0.2","10.0.0.1","TCP","78","34567  >  52142 [ACK] Seq=1 Ack=26665 Win=101376 Len=0 TSval=1359183 TSecr=1359153 SLE=28113 SRE=36801"
"45","1.203870418","10.0.0.1","10.0.0.2","TCP","2962","52142  >  34567 [ACK] Seq=39697 Ack=1 Win=29696 Len=2896 TSval=1359204 TSecr=1359179"
"46","1.266613181","10.0.0.2","10.0.0.1","TCP","78","[TCP Window Update] 34567  >  52142 [ACK] Seq=1 Ack=26665 Win=104448 Len=0 TSval=1359213 TSecr=1359153 SLE=28113 SRE=38249"
"47","1.286549527","10.0.0.2","10.0.0.1","TCP","78","[TCP Window Update] 34567  >  52142 [ACK] Seq=1 Ack=26665 Win=107520 Len=0 TSval=1359216 TSecr=1359153 SLE=28113 SRE=39697"
"48","1.329576524","10.0.0.1","10.0.0.2","TCP","1514","[TCP Previous segment not captured] 52142  >  34567 [ACK] Seq=44041 Ack=1 Win=29696 Len=1448 TSval=1359239 TSecr=1359213"
"49","1.348890449","10.0.0.1","10.0.0.2","TCP","1514","[TCP Out-Of-Order] 52142  >  34567 [ACK] Seq=26665 Ack=1 Win=29696 Len=1448 TSval=1359244 TSecr=1359216"
"50","1.356137185","10.0.0.2","10.0.0.1","TCP","78","[TCP Window Update] 34567  >  52142 [ACK] Seq=1 Ack=26665 Win=113152 Len=0 TSval=1359236 TSecr=1359153 SLE=28113 SRE=42593"
"51","1.431068837","10.0.0.1","10.0.0.2","TCP","2962","52142  >  34567 [ACK] Seq=45489 Ack=1 Win=29696 Len=2896 TSval=1359261 TSecr=1359236"
"52","1.481460420","10.0.0.2","10.0.0.1","TCP","86","[TCP Window Update] 34567  >  52142 [ACK] Seq=1 Ack=26665 Win=116224 Len=0 TSval=1359267 TSecr=1359153 SLE=44041 SRE=45489 SLE=28113 SRE=42593"
"53","1.505282270","10.0.0.2","10.0.0.1","TCP","78","34567  >  52142 [ACK] Seq=1 Ack=42593 Win=118784 Len=0 TSval=1359272 TSecr=1359244 SLE=44041 SRE=45489"
"54","1.543825240","10.0.0.1","10.0.0.2","TCP","1514","[TCP Out-Of-Order] 52142  >  34567 [ACK] Seq=42593 Ack=1 Win=29696 Len=1448 TSval=1359293 TSecr=1359267"
"55","1.568056475","10.0.0.1","10.0.0.2","TCP","1514","52142  >  34567 [ACK] Seq=48385 Ack=1 Win=29696 Len=1448 TSval=1359299 TSecr=1359272"
"56","1.583695023","10.0.0.2","10.0.0.1","TCP","78","[TCP Window Update] 34567  >  52142 [ACK] Seq=1 Ack=42593 Win=124928 Len=0 TSval=1359293 TSecr=1359244 SLE=44041 SRE=48385"
"57","1.658708751","10.0.0.1","10.0.0.2","TCP","2962","52142  >  34567 [ACK] Seq=49833 Ack=1 Win=29696 Len=2896 TSval=1359318 TSecr=1359293"
"58","1.699077199","10.0.0.2","10.0.0.1","TCP","66","34567  >  52142 [ACK] Seq=1 Ack=48385 Win=127488 Len=0 TSval=1359322 TSecr=1359293"
"59","1.720344578","10.0.0.2","10.0.0.1","TCP","66","34567  >  52142 [ACK] Seq=1 Ack=49833 Win=130560 Len=0 TSval=1359327 TSecr=1359299"
"60","1.801383417","10.0.0.1","10.0.0.2","TCP","2962","52142  >  34567 [ACK] Seq=52729 Ack=1 Win=29696 Len=2896 TSval=1359347 TSecr=1359322"
"61","1.801393281","10.0.0.1","10.0.0.2","TCP","1514","52142  >  34567 [ACK] Seq=55625 Ack=1 Win=29696 Len=1448 TSval=1359352 TSecr=1359327"
"62","1.815234030","10.0.0.2","10.0.0.1","TCP","66","34567  >  52142 [ACK] Seq=1 Ack=52729 Win=136192 Len=0 TSval=1359350 TSecr=1359318"
"63","1.890153559","10.0.0.1","10.0.0.2","TCP","2962","52142  >  34567 [ACK] Seq=57073 Ack=1 Win=29696 Len=2896 TSval=1359376 TSecr=1359350"
"64","1.962205468","10.0.0.2","10.0.0.1","TCP","66","34567  >  52142 [ACK] Seq=1 Ack=55625 Win=142336 Len=0 TSval=1359385 TSecr=1359347"
"65","1.971814091","10.0.0.2","10.0.0.1","TCP","66","34567  >  52142 [ACK] Seq=1 Ack=57073 Win=144896 Len=0 TSval=1359389 TSecr=1359352"
"66","2.038089666","10.0.0.1","10.0.0.2","TCP","2962","52142  >  34567 [ACK] Seq=59969 Ack=1 Win=29696 Len=2896 TSval=1359413 TSecr=1359385"
"67","2.045006411","10.0.0.2","10.0.0.1","TCP","66","34567  >  52142 [ACK] Seq=1 Ack=59969 Win=151040 Len=0 TSval=1359408 TSecr=1359376"
"68","2.049119897","10.0.0.1","10.0.0.2","TCP","1514","52142  >  34567 [ACK] Seq=62865 Ack=1 Win=29696 Len=1448 TSval=1359415 TSecr=1359389"
"69","2.120398256","10.0.0.1","10.0.0.2","TCP","2962","52142  >  34567 [ACK] Seq=64313 Ack=1 Win=29696 Len=2896 TSval=1359433 TSecr=1359408"
"70","2.190725580","10.0.0.2","10.0.0.1","TCP","66","34567  >  52142 [ACK] Seq=1 Ack=62865 Win=156672 Len=0 TSval=1359445 TSecr=1359413"
"71","2.203725344","10.0.0.2","10.0.0.1","TCP","66","34567  >  52142 [ACK] Seq=1 Ack=64313 Win=159744 Len=0 TSval=1359448 TSecr=1359415"
"72","2.267168832","10.0.0.1","10.0.0.2","TCP","2962","52142  >  34567 [ACK] Seq=67209 Ack=1 Win=29696 Len=2896 TSval=1359470 TSecr=1359445"
"73","2.274485254","10.0.0.2","10.0.0.1","TCP","66","34567  >  52142 [ACK] Seq=1 Ack=67209 Win=165376 Len=0 TSval=1359465 TSecr=1359433"
"74","2.278104372","10.0.0.1","10.0.0.2","TCP","1514","52142  >  34567 [ACK] Seq=70105 Ack=1 Win=29696 Len=1448 TSval=1359473 TSecr=1359448"
"75","2.350129659","10.0.0.1","10.0.0.2","TCP","2962","52142  >  34567 [ACK] Seq=71553 Ack=1 Win=29696 Len=2896 TSval=1359491 TSecr=1359465"
"76","2.420205940","10.0.0.2","10.0.0.1","TCP","66","34567  >  52142 [ACK] Seq=1 Ack=70105 Win=170496 Len=0 TSval=1359502 TSecr=1359470"
"77","2.471560009","10.0.0.2","10.0.0.1","TCP","66","34567  >  52142 [ACK] Seq=1 Ack=71553 Win=170496 Len=0 TSval=1359515 TSecr=1359473"
"78","2.501515457","10.0.0.1","10.0.0.2","TCP","2962","52142  >  34567 [ACK] Seq=74449 Ack=1 Win=29696 Len=2896 TSval=1359527 TSecr=1359502"
"79","2.502691081","10.0.0.2","10.0.0.1","TCP","66","34567  >  52142 [ACK] Seq=1 Ack=74449 Win=170496 Len=0 TSval=1359523 TSecr=1359491"
"80","2.548035665","10.0.0.1","10.0.0.2","TCP","2962","52142  >  34567 [ACK] Seq=77345 Ack=1 Win=29696 Len=2896 TSval=1359540 TSecr=1359515"
"81","2.578192037","10.0.0.1","10.0.0.2","TCP","2962","52142  >  34567 [ACK] Seq=80241 Ack=1 Win=29696 Len=2896 TSval=1359548 TSecr=1359523"
"82","2.657026875","10.0.0.2","10.0.0.1","TCP","66","34567  >  52142 [ACK] Seq=1 Ack=77345 Win=170496 Len=0 TSval=1359561 TSecr=1359527"
"83","2.703245028","10.0.0.2","10.0.0.1","TCP","66","34567  >  52142 [ACK] Seq=1 Ack=80241 Win=170496 Len=0 TSval=1359572 TSecr=1359540"
"84","2.731773131","10.0.0.1","10.0.0.2","TCP","2962","52142  >  34567 [ACK] Seq=83137 Ack=1 Win=29696 Len=2896 TSval=1359586 TSecr=1359561"
"85","2.731769536","10.0.0.2","10.0.0.1","TCP","66","34567  >  52142 [ACK] Seq=1 Ack=83137 Win=170496 Len=0 TSval=1359580 TSecr=1359548"
"86","2.777886632","10.0.0.1","10.0.0.2","TCP","2962","52142  >  34567 [ACK] Seq=86033 Ack=1 Win=29696 Len=2896 TSval=1359598 TSecr=1359572"
"87","2.806603112","10.0.0.1","10.0.0.2","TCP","2962","52142  >  34567 [ACK] Seq=88929 Ack=1 Win=29696 Len=2896 TSval=1359605 TSecr=1359580"
"88","2.885150742","10.0.0.2","10.0.0.1","TCP","66","34567  >  52142 [ACK] Seq=1 Ack=86033 Win=170496 Len=0 TSval=1359618 TSecr=1359586"
"89","2.930998197","10.0.0.2","10.0.0.1","TCP","66","34567  >  52142 [ACK] Seq=1 Ack=88929 Win=170496 Len=0 TSval=1359629 TSecr=1359598"
"90","2.957616282","10.0.0.2","10.0.0.1","TCP","66","34567  >  52142 [ACK] Seq=1 Ack=91825 Win=170496 Len=0 TSval=1359636 TSecr=1359605"
"91","2.961740994","10.0.0.1","10.0.0.2","TCP","2962","52142  >  34567 [ACK] Seq=91825 Ack=1 Win=29696 Len=2896 TSval=1359643 TSecr=1359618"
"92","3.006015254","10.0.0.1","10.0.0.2","TCP","2962","52142  >  34567 [ACK] Seq=94721 Ack=1 Win=29696 Len=2896 TSval=1359655 TSecr=1359629"
"93","3.032733349","10.0.0.1","10.0.0.2","TCP","2962","52142  >  34567 [ACK] Seq=97617 Ack=1 Win=29696 Len=2896 TSval=1359662 TSecr=1359636"
"94","3.045281498","10.0.0.1","10.0.0.2","TCP","1514","52142  >  34567 [ACK] Seq=100513 Ack=1 Win=29696 Len=1448 TSval=1359662 TSecr=1359636"
"95","3.116891183","10.0.0.2","10.0.0.1","TCP","66","34567  >  52142 [ACK] Seq=1 Ack=94721 Win=170496 Len=0 TSval=1359676 TSecr=1359643"
"96","3.157100773","10.0.0.2","10.0.0.1","TCP","66","34567  >  52142 [ACK] Seq=1 Ack=97617 Win=170496 Len=0 TSval=1359686 TSecr=1359655"
"97","3.189314863","10.0.0.2","10.0.0.1","TCP","66","34567  >  52142 [ACK] Seq=1 Ack=100513 Win=170496 Len=0 TSval=1359693 TSecr=1359662"
"98","3.194015712","10.0.0.1","10.0.0.2","TCP","2962","52142  >  34567 [ACK] Seq=101961 Ack=1 Win=29696 Len=2896 TSval=1359701 TSecr=1359676"
"99","3.248222680","10.0.0.2","10.0.0.1","TCP","66","34567  >  52142 [ACK] Seq=1 Ack=101961 Win=170496 Len=0 TSval=1359709 TSecr=1359662"
"100","3.264396282","10.0.0.1","10.0.0.2","TCP","2962","[TCP Previous segment not captured] 52142  >  34567 [ACK] Seq=107753 Ack=1 Win=29696 Len=2896 TSval=1359719 TSecr=1359693"
"101","3.310946535","10.0.0.1","10.0.0.2","TCP","1514","52142  >  34567 [ACK] Seq=110649 Ack=1 Win=29696 Len=1448 TSval=1359734 TSecr=1359709"
"102","3.347644988","10.0.0.2","10.0.0.1","TCP","66","34567  >  52142 [ACK] Seq=1 Ack=104857 Win=170496 Len=0 TSval=1359734 TSecr=1359701"
"103","3.427437810","10.0.0.1","10.0.0.2","TCP","2962","52142  >  34567 [ACK] Seq=112097 Ack=1 Win=29696 Len=2896 TSval=1359759 TSecr=1359734"
"104","3.427432065","10.0.0.2","10.0.0.1","TCP","78","[TCP Dup ACK 102#1] 34567  >  52142 [ACK] Seq=1 Ack=104857 Win=170496 Len=0 TSval=1359751 TSecr=1359701 SLE=107753 SRE=110649"
"105","3.467535018","10.0.0.2","10.0.0.1","TCP","78","[TCP Dup ACK 102#2] 34567  >  52142 [ACK] Seq=1 Ack=104857 Win=170496 Len=0 TSval=1359763 TSecr=1359701 SLE=107753 SRE=112097"
"106","3.489652092","10.0.0.1","10.0.0.2","TCP","1514","[TCP Out-Of-Order] 52142  >  34567 [ACK] Seq=104857 Ack=1 Win=29696 Len=1448 TSval=1359779 TSecr=1359751"
"107","3.530621917","10.0.0.1","10.0.0.2","TCP","1514","[TCP Out-Of-Order] 52142  >  34567 [ACK] Seq=106305 Ack=1 Win=29696 Len=1448 TSval=1359789 TSecr=1359763"
"108","3.580178471","10.0.0.2","10.0.0.1","TCP","78","[TCP Dup ACK 102#3] 34567  >  52142 [ACK] Seq=1 Ack=104857 Win=170496 Len=0 TSval=1359792 TSecr=1359701 SLE=107753 SRE=114993"
"109","3.644165813","10.0.0.2","10.0.0.1","TCP","78","34567  >  52142 [ACK] Seq=1 Ack=106305 Win=169472 Len=0 TSval=1359807 TSecr=1359779 SLE=107753 SRE=114993"
"110","3.654811590","10.0.0.1","10.0.0.2","TCP","2962","52142  >  34567 [ACK] Seq=114993 Ack=1 Win=29696 Len=2896 TSval=1359817 TSecr=1359792"
"111","3.683129092","10.0.0.2","10.0.0.1","TCP","66","34567  >  52142 [ACK] Seq=1 Ack=114993 Win=167936 Len=0 TSval=1359818 TSecr=1359789"
"112","3.757962405","10.0.0.1","10.0.0.2","TCP","2962","[TCP Previous segment not captured] 52142  >  34567 [ACK] Seq=120785 Ack=1 Win=29696 Len=2896 TSval=1359843 TSecr=1359818"
"113","3.808186936","10.0.0.2","10.0.0.1","TCP","66","34567  >  52142 [ACK] Seq=1 Ack=117889 Win=170496 Len=0 TSval=1359849 TSecr=1359817"
"114","3.909391674","10.0.0.2","10.0.0.1","TCP","78","[TCP Dup ACK 113#1] 34567  >  52142 [ACK] Seq=1 Ack=117889 Win=170496 Len=0 TSval=1359874 TSecr=1359817 SLE=120785 SRE=123681"
"115","3.972383356","10.0.0.1","10.0.0.2","TCP","1514","[TCP Out-Of-Order] 52142  >  34567 [ACK] Seq=117889 Ack=1 Win=29696 Len=1448 TSval=1359900 TSecr=1359874"
"116","4.125997414","10.0.0.2","10.0.0.1","TCP","78","34567  >  52142 [ACK] Seq=1 Ack=119337 Win=169472 Len=0 TSval=1359928 TSecr=1359900 SLE=120785 SRE=123681"
"117","4.188402588","10.0.0.1","10.0.0.2","TCP","1514","52142  >  34567 [ACK] Seq=123681 Ack=1 Win=29696 Len=1448 TSval=1359954 TSecr=1359928"
"118","4.200973673","10.0.0.1","10.0.0.2","TCP","1514","52142  >  34567 [ACK] Seq=125129 Ack=1 Win=29696 Len=1448 TSval=1359954 TSecr=1359928"
"119","4.342906546","10.0.0.2","10.0.0.1","TCP","78","[TCP Dup ACK 116#1] 34567  >  52142 [ACK] Seq=1 Ack=119337 Win=169472 Len=0 TSval=1359982 TSecr=1359900 SLE=120785 SRE=125129"
"120","4.355893646","10.0.0.2","10.0.0.1","TCP","78","[TCP Dup ACK 116#2] 34567  >  52142 [ACK] Seq=1 Ack=119337 Win=169472 Len=0 TSval=1359985 TSecr=1359900 SLE=120785 SRE=126577"
"121","4.405968577","10.0.0.1","10.0.0.2","TCP","1514","52142  >  34567 [ACK] Seq=126577 Ack=1 Win=29696 Len=1448 TSval=1360008 TSecr=1359982"
"122","4.418279007","10.0.0.1","10.0.0.2","TCP","1514","52142  >  34567 [ACK] Seq=128025 Ack=1 Win=29696 Len=1448 TSval=1360011 TSecr=1359985"
"123","4.565575623","10.0.0.2","10.0.0.1","TCP","78","[TCP Dup ACK 116#3] 34567  >  52142 [ACK] Seq=1 Ack=119337 Win=169472 Len=0 TSval=1360038 TSecr=1359900 SLE=120785 SRE=128025"
"124","4.574524076","10.0.0.2","10.0.0.1","TCP","78","[TCP Dup ACK 116#4] 34567  >  52142 [ACK] Seq=1 Ack=119337 Win=169472 Len=0 TSval=1360040 TSecr=1359900 SLE=120785 SRE=129473"
"125","4.629613596","10.0.0.1","10.0.0.2","TCP","1514","[TCP Out-Of-Order] 52142  >  34567 [ACK] Seq=119337 Ack=1 Win=29696 Len=1448 TSval=1360064 TSecr=1359985"
"126","4.784083165","10.0.0.2","10.0.0.1","TCP","66","34567  >  52142 [ACK] Seq=1 Ack=129473 Win=166400 Len=0 TSval=1360092 TSecr=1360064"
"127","4.859774113","10.0.0.1","10.0.0.2","TCP","2962","52142  >  34567 [ACK] Seq=129473 Ack=1 Win=29696 Len=2896 TSval=1360118 TSecr=1360092"
"128","4.884398360","10.0.0.1","10.0.0.2","TCP","2962","52142  >  34567 [ACK] Seq=132369 Ack=1 Win=29696 Len=2896 TSval=1360118 TSecr=1360092"
"129","5.012579061","10.0.0.2","10.0.0.1","TCP","66","34567  >  52142 [ACK] Seq=1 Ack=132369 Win=170496 Len=0 TSval=1360150 TSecr=1360118"
"130","5.036529626","10.0.0.2","10.0.0.1","TCP","66","34567  >  52142 [ACK] Seq=1 Ack=135265 Win=170496 Len=0 TSval=1360156 TSecr=1360118"
"131","5.088104571","10.0.0.1","10.0.0.2","TCP","2962","52142  >  34567 [ACK] Seq=135265 Ack=1 Win=29696 Len=2896 TSval=1360175 TSecr=1360150"
"132","5.112072864","10.0.0.1","10.0.0.2","TCP","2962","52142  >  34567 [ACK] Seq=138161 Ack=1 Win=29696 Len=2896 TSval=1360181 TSecr=1360156"
"133","5.240637184","10.0.0.2","10.0.0.1","TCP","66","34567  >  52142 [ACK] Seq=1 Ack=138161 Win=170496 Len=0 TSval=1360207 TSecr=1360175"
"134","5.270228886","10.0.0.2","10.0.0.1","TCP","66","34567  >  52142 [ACK] Seq=1 Ack=141057 Win=170496 Len=0 TSval=1360213 TSecr=1360181"
"135","5.315856087","10.0.0.1","10.0.0.2","TCP","2962","52142  >  34567 [ACK] Seq=141057 Ack=1 Win=29696 Len=2896 TSval=1360232 TSecr=1360207"
"136","5.345036916","10.0.0.1","10.0.0.2","TCP","2962","52142  >  34567 [ACK] Seq=143953 Ack=1 Win=29696 Len=2896 TSval=1360240 TSecr=1360213"
"137","5.358118061","10.0.0.1","10.0.0.2","TCP","1514","52142  >  34567 [ACK] Seq=146849 Ack=1 Win=29696 Len=1448 TSval=1360240 TSecr=1360213"
"138","5.470359855","10.0.0.2","10.0.0.1","TCP","66","34567  >  52142 [ACK] Seq=1 Ack=143953 Win=170496 Len=0 TSval=1360264 TSecr=1360232"
"139","5.499560978","10.0.0.2","10.0.0.1","TCP","66","34567  >  52142 [ACK] Seq=1 Ack=146849 Win=170496 Len=0 TSval=1360271 TSecr=1360240"
"140","5.517988397","10.0.0.2","10.0.0.1","TCP","66","34567  >  52142 [ACK] Seq=1 Ack=148297 Win=170496 Len=0 TSval=1360275 TSecr=1360240"
"141","5.545276526","10.0.0.1","10.0.0.2","TCP","2962","52142  >  34567 [ACK] Seq=148297 Ack=1 Win=29696 Len=2896 TSval=1360290 TSecr=1360264"
"142","5.574438898","10.0.0.1","10.0.0.2","TCP","2962","52142  >  34567 [ACK] Seq=151193 Ack=1 Win=29696 Len=2896 TSval=1360297 TSecr=1360271"
"143","5.598381530","10.0.0.1","10.0.0.2","TCP","2962","52142  >  34567 [ACK] Seq=154089 Ack=1 Win=29696 Len=2896 TSval=1360302 TSecr=1360275"
"144","5.706022884","10.0.0.2","10.0.0.1","TCP","66","34567  >  52142 [ACK] Seq=1 Ack=151193 Win=170496 Len=0 TSval=1360321 TSecr=1360290"
"145","5.726800774","10.0.0.2","10.0.0.1","TCP","66","34567  >  52142 [ACK] Seq=1 Ack=154089 Win=170496 Len=0 TSval=1360329 TSecr=1360297"
"146","5.756886119","10.0.0.2","10.0.0.1","TCP","66","34567  >  52142 [ACK] Seq=1 Ack=156985 Win=170496 Len=0 TSval=1360335 TSecr=1360302"
"147","5.781550159","10.0.0.1","10.0.0.2","TCP","2962","52142  >  34567 [ACK] Seq=156985 Ack=1 Win=29696 Len=2896 TSval=1360349 TSecr=1360321"
"148","5.804961491","10.0.0.1","10.0.0.2","TCP","2962","52142  >  34567 [ACK] Seq=159881 Ack=1 Win=29696 Len=2896 TSval=1360354 TSecr=1360329"
"149","5.831446476","10.0.0.1","10.0.0.2","TCP","2962","52142  >  34567 [ACK] Seq=162777 Ack=1 Win=29696 Len=2896 TSval=1360361 TSecr=1360335"
"150","5.934053541","10.0.0.2","10.0.0.1","TCP","66","34567  >  52142 [ACK] Seq=1 Ack=159881 Win=170496 Len=0 TSval=1360380 TSecr=1360349"
"151","5.961180649","10.0.0.2","10.0.0.1","TCP","66","34567  >  52142 [ACK] Seq=1 Ack=162777 Win=170496 Len=0 TSval=1360386 TSecr=1360354"
"152","5.985907855","10.0.0.2","10.0.0.1","TCP","66","34567  >  52142 [ACK] Seq=1 Ack=165673 Win=170496 Len=0 TSval=1360393 TSecr=1360361"
"153","6.008504518","10.0.0.1","10.0.0.2","TCP","2962","52142  >  34567 [ACK] Seq=165673 Ack=1 Win=29696 Len=2896 TSval=1360406 TSecr=1360380"
"154","6.060452588","10.0.0.1","10.0.0.2","TCP","2962","[TCP Previous segment not captured] 52142  >  34567 [ACK] Seq=171465 Ack=1 Win=29696 Len=2896 TSval=1360419 TSecr=1360393"
"155","6.073332001","10.0.0.1","10.0.0.2","TCP","1514","52142  >  34567 [ACK] Seq=174361 Ack=1 Win=29696 Len=1448 TSval=1360419 TSecr=1360393"
"156","6.161596792","10.0.0.2","10.0.0.1","TCP","66","34567  >  52142 [ACK] Seq=1 Ack=168569 Win=170496 Len=0 TSval=1360437 TSecr=1360406"
"157","6.211839892","10.0.0.2","10.0.0.1","TCP","78","[TCP Dup ACK 156#1] 34567  >  52142 [ACK] Seq=1 Ack=168569 Win=170496 Len=0 TSval=1360450 TSecr=1360406 SLE=171465 SRE=174361"
"158","6.225509532","10.0.0.2","10.0.0.1","TCP","78","[TCP Dup ACK 156#2] 34567  >  52142 [ACK] Seq=1 Ack=168569 Win=170496 Len=0 TSval=1360453 TSecr=1360406 SLE=171465 SRE=175809"
"159","6.236063050","10.0.0.1","10.0.0.2","TCP","2962","52142  >  34567 [ACK] Seq=175809 Ack=1 Win=29696 Len=2896 TSval=1360463 TSecr=1360437"
"160","6.275243149","10.0.0.1","10.0.0.2","TCP","1514","[TCP Out-Of-Order] 52142  >  34567 [ACK] Seq=168569 Ack=1 Win=29696 Len=1448 TSval=1360475 TSecr=1360450"
"161","6.288217345","10.0.0.1","10.0.0.2","TCP","1514","[TCP Out-Of-Order] 52142  >  34567 [ACK] Seq=170017 Ack=1 Win=29696 Len=1448 TSval=1360479 TSecr=1360453"
"162","6.387833366","10.0.0.2","10.0.0.1","TCP","78","[TCP Dup ACK 156#3] 34567  >  52142 [ACK] Seq=1 Ack=168569 Win=170496 Len=0 TSval=1360494 TSecr=1360406 SLE=171465 SRE=178705"
"163","6.427305491","10.0.0.2","10.0.0.1","TCP","78","34567  >  52142 [ACK] Seq=1 Ack=170017 Win=169472 Len=0 TSval=1360504 TSecr=1360475 SLE=171465 SRE=178705"
"164","6.440196398","10.0.0.2","10.0.0.1","TCP","66","34567  >  52142 [ACK] Seq=1 Ack=178705 Win=167936 Len=0 TSval=1360507 TSecr=1360479"
"165","6.462574597","10.0.0.1","10.0.0.2","TCP","2962","52142  >  34567 [ACK] Seq=178705 Ack=1 Win=29696 Len=2896 TSval=1360519 TSecr=1360494"
"166","6.489568766","10.0.0.1","10.0.0.2","TCP","1514","52142  >  34567 [ACK] Seq=181601 Ack=1 Win=29696 Len=1448 TSval=1360529 TSecr=1360504"
"167","6.515281006","10.0.0.1","10.0.0.2","TCP","2962","52142  >  34567 [ACK] Seq=183049 Ack=1 Win=29696 Len=2896 TSval=1360532 TSecr=1360507"
"168","6.614353028","10.0.0.2","10.0.0.1","TCP","66","34567  >  52142 [ACK] Seq=1 Ack=181601 Win=170496 Len=0 TSval=1360550 TSecr=1360519"
"169","6.668246663","10.0.0.2","10.0.0.1","TCP","66","34567  >  52142 [ACK] Seq=1 Ack=185945 Win=170496 Len=0 TSval=1360564 TSecr=1360529"
"170","6.689225996","10.0.0.1","10.0.0.2","TCP","2962","52142  >  34567 [ACK] Seq=185945 Ack=1 Win=29696 Len=2896 TSval=1360576 TSecr=1360550"
"171","6.742663790","10.0.0.1","10.0.0.2","TCP","2962","52142  >  34567 [ACK] Seq=188841 Ack=1 Win=29696 Len=2896 TSval=1360589 TSecr=1360564"
"172","6.767232027","10.0.0.1","10.0.0.2","TCP","2962","52142  >  34567 [ACK] Seq=191737 Ack=1 Win=29696 Len=2896 TSval=1360589 TSecr=1360564"
"173","6.843404801","10.0.0.2","10.0.0.1","TCP","66","34567  >  52142 [ACK] Seq=1 Ack=188841 Win=170496 Len=0 TSval=1360607 TSecr=1360576"
"174","6.894876702","10.0.0.2","10.0.0.1","TCP","66","34567  >  52142 [ACK] Seq=1 Ack=191737 Win=170496 Len=0 TSval=1360621 TSecr=1360589"
"175","6.918376360","10.0.0.1","10.0.0.2","TCP","2962","52142  >  34567 [ACK] Seq=194633 Ack=1 Win=29696 Len=2896 TSval=1360633 TSecr=1360607"
"176","6.920874537","10.0.0.2","10.0.0.1","TCP","66","34567  >  52142 [ACK] Seq=1 Ack=194633 Win=170496 Len=0 TSval=1360627 TSecr=1360589"
"177","6.979662528","10.0.0.1","10.0.0.2","TCP","2962","52142  >  34567 [ACK] Seq=197529 Ack=1 Win=29696 Len=2896 TSval=1360646 TSecr=1360621"
"178","6.997908382","10.0.0.1","10.0.0.2","TCP","2962","52142  >  34567 [ACK] Seq=200425 Ack=1 Win=29696 Len=2896 TSval=1360652 TSecr=1360627"
"179","7.010255671","10.0.0.1","10.0.0.2","TCP","1514","52142  >  34567 [ACK] Seq=203321 Ack=1 Win=29696 Len=1448 TSval=1360652 TSecr=1360627"
"180","7.071567643","10.0.0.2","10.0.0.1","TCP","66","34567  >  52142 [ACK] Seq=1 Ack=197529 Win=170496 Len=0 TSval=1360664 TSecr=1360633"
"181","7.131164934","10.0.0.2","10.0.0.1","TCP","66","34567  >  52142 [ACK] Seq=1 Ack=200425 Win=170496 Len=0 TSval=1360680 TSecr=1360646"
"182","7.147831273","10.0.0.1","10.0.0.2","TCP","2962","52142  >  34567 [ACK] Seq=204769 Ack=1 Win=29696 Len=2896 TSval=1360690 TSecr=1360664"
"183","7.151075900","10.0.0.2","10.0.0.1","TCP","66","34567  >  52142 [ACK] Seq=1 Ack=203321 Win=170496 Len=0 TSval=1360684 TSecr=1360652"
"184","7.205728855","10.0.0.1","10.0.0.2","TCP","2962","52142  >  34567 [ACK] Seq=207665 Ack=1 Win=29696 Len=2896 TSval=1360705 TSecr=1360680"
"185","7.208512035","10.0.0.2","10.0.0.1","TCP","66","34567  >  52142 [ACK] Seq=1 Ack=204769 Win=170496 Len=0 TSval=1360699 TSecr=1360652"
"186","7.233145322","10.0.0.1","10.0.0.2","TCP","2962","52142  >  34567 [ACK] Seq=210561 Ack=1 Win=29696 Len=2896 TSval=1360710 TSecr=1360684"
"187","7.270934978","10.0.0.1","10.0.0.2","TCP","1514","52142  >  34567 [ACK] Seq=213457 Ack=1 Win=29696 Len=1448 TSval=1360724 TSecr=1360699"
"188","7.299575407","10.0.0.2","10.0.0.1","TCP","66","34567  >  52142 [ACK] Seq=1 Ack=207665 Win=170496 Len=0 TSval=1360722 TSecr=1360690"
"189","7.357698638","10.0.0.2","10.0.0.1","TCP","66","34567  >  52142 [ACK] Seq=1 Ack=210561 Win=170496 Len=0 TSval=1360736 TSecr=1360705"
"190","7.374841714","10.0.0.1","10.0.0.2","TCP","2962","52142  >  34567 [ACK] Seq=214905 Ack=1 Win=29696 Len=2896 TSval=1360747 TSecr=1360722"
"191","7.384915069","10.0.0.2","10.0.0.1","TCP","66","34567  >  52142 [ACK] Seq=1 Ack=213457 Win=170496 Len=0 TSval=1360743 TSecr=1360710"
"192","7.432453039","10.0.0.1","10.0.0.2","TCP","2962","52142  >  34567 [ACK] Seq=217801 Ack=1 Win=29696 Len=2896 TSval=1360762 TSecr=1360736"
"193","7.459501634","10.0.0.1","10.0.0.2","TCP","2962","52142  >  34567 [ACK] Seq=220697 Ack=1 Win=29696 Len=2896 TSval=1360768 TSecr=1360743"
"194","7.495187074","10.0.0.2","10.0.0.1","TCP","66","34567  >  52142 [ACK] Seq=1 Ack=214905 Win=170496 Len=0 TSval=1360770 TSecr=1360724"
"195","7.535360947","10.0.0.2","10.0.0.1","TCP","66","34567  >  52142 [ACK] Seq=1 Ack=217801 Win=170496 Len=0 TSval=1360779 TSecr=1360747"
"196","7.557582184","10.0.0.1","10.0.0.2","TCP","1514","52142  >  34567 [ACK] Seq=223593 Ack=1 Win=29696 Len=1448 TSval=1360796 TSecr=1360770"
"197","7.586021877","10.0.0.2","10.0.0.1","TCP","66","34567  >  52142 [ACK] Seq=1 Ack=220697 Win=170496 Len=0 TSval=1360793 TSecr=1360762"
"198","7.612371046","10.0.0.2","10.0.0.1","TCP","66","34567  >  52142 [ACK] Seq=1 Ack=223593 Win=170496 Len=0 TSval=1360800 TSecr=1360768"
"199","7.661923988","10.0.0.1","10.0.0.2","TCP","2962","[TCP Previous segment not captured] 52142  >  34567 [ACK] Seq=227937 Ack=1 Win=29696 Len=2896 TSval=1360819 TSecr=1360793"
"200","7.687250765","10.0.0.1","10.0.0.2","TCP","2962","52142  >  34567 [ACK] Seq=230833 Ack=1 Win=29696 Len=2896 TSval=1360825 TSecr=1360800"
"201","7.816850307","10.0.0.2","10.0.0.1","TCP","78","34567  >  52142 [ACK] Seq=1 Ack=225041 Win=170496 Len=0 TSval=1360851 TSecr=1360796 SLE=227937 SRE=230833"
"202","7.845981076","10.0.0.2","10.0.0.1","TCP","78","[TCP Dup ACK 201#1] 34567  >  52142 [ACK] Seq=1 Ack=225041 Win=170496 Len=0 TSval=1360858 TSecr=1360796 SLE=227937 SRE=233729"
"203","7.879622467","10.0.0.1","10.0.0.2","TCP","1514","[TCP Out-Of-Order] 52142  >  34567 [ACK] Seq=225041 Ack=1 Win=29696 Len=1448 TSval=1360876 TSecr=1360851"
"204","7.908772722","10.0.0.1","10.0.0.2","TCP","1514","[TCP Retransmission] 52142  >  34567 [ACK] Seq=226489 Ack=1 Win=29696 Len=1448 TSval=1360884 TSecr=1360858"
"205","7.920934539","10.0.0.1","10.0.0.2","TCP","1514","52142  >  34567 [ACK] Seq=233729 Ack=1 Win=29696 Len=1448 TSval=1360884 TSecr=1360858"
"206","8.035239869","10.0.0.2","10.0.0.1","TCP","78","34567  >  52142 [ACK] Seq=1 Ack=226489 Win=169472 Len=0 TSval=1360905 TSecr=1360876 SLE=227937 SRE=233729"
"207","8.061102759","10.0.0.2","10.0.0.1","TCP","66","34567  >  52142 [ACK] Seq=1 Ack=233729 Win=168960 Len=0 TSval=1360912 TSecr=1360884"
"208","8.098204473","10.0.0.1","10.0.0.2","TCP","1514","52142  >  34567 [ACK] Seq=235177 Ack=1 Win=29696 Len=1448 TSval=1360931 TSecr=1360905"
"209","8.110719491","10.0.0.1","10.0.0.2","TCP","1514","52142  >  34567 [ACK] Seq=236625 Ack=1 Win=29696 Len=1448 TSval=1360931 TSecr=1360905"
"210","8.137059852","10.0.0.1","10.0.0.2","TCP","2962","52142  >  34567 [ACK] Seq=238073 Ack=1 Win=29696 Len=2896 TSval=1360937 TSecr=1360912"
"211","8.140849613","10.0.0.2","10.0.0.1","TCP","66","34567  >  52142 [ACK] Seq=1 Ack=235177 Win=170496 Len=0 TSval=1360932 TSecr=1360884"
"212","8.203180506","10.0.0.1","10.0.0.2","TCP","1514","52142  >  34567 [ACK] Seq=240969 Ack=1 Win=29696 Len=1448 TSval=1360957 TSecr=1360932"
"213","8.262466866","10.0.0.2","10.0.0.1","TCP","66","34567  >  52142 [ACK] Seq=1 Ack=238073 Win=170496 Len=0 TSval=1360962 TSecr=1360931"
"214","8.293555035","10.0.0.2","10.0.0.1","TCP","66","34567  >  52142 [ACK] Seq=1 Ack=240969 Win=169984 Len=0 TSval=1360969 TSecr=1360937"
"215","8.337884342","10.0.0.1","10.0.0.2","TCP","2962","52142  >  34567 [ACK] Seq=242417 Ack=1 Win=29696 Len=2896 TSval=1360988 TSecr=1360962"
"216","8.369689709","10.0.0.1","10.0.0.2","TCP","2962","52142  >  34567 [ACK] Seq=245313 Ack=1 Win=29696 Len=2896 TSval=1360996 TSecr=1360969"
"217","8.459421926","10.0.0.2","10.0.0.1","TCP","66","34567  >  52142 [ACK] Seq=1 Ack=242417 Win=170496 Len=0 TSval=1361012 TSecr=1360957"
"218","8.502035802","10.0.0.2","10.0.0.1","TCP","66","34567  >  52142 [ACK] Seq=1 Ack=245313 Win=170496 Len=0 TSval=1361019 TSecr=1360988"
"219","8.521713273","10.0.0.2","10.0.0.1","TCP","66","34567  >  52142 [ACK] Seq=1 Ack=248209 Win=170496 Len=0 TSval=1361027 TSecr=1360996"
"220","8.533886307","10.0.0.1","10.0.0.2","TCP","2962","52142  >  34567 [ACK] Seq=248209 Ack=1 Win=29696 Len=2896 TSval=1361037 TSecr=1361012"
"221","8.577832845","10.0.0.1","10.0.0.2","TCP","2962","52142  >  34567 [ACK] Seq=251105 Ack=1 Win=29696 Len=2896 TSval=1361048 TSecr=1361019"
"222","8.601337797","10.0.0.1","10.0.0.2","TCP","2962","52142  >  34567 [ACK] Seq=254001 Ack=1 Win=29696 Len=2896 TSval=1361053 TSecr=1361027"
"223","8.613635853","10.0.0.1","10.0.0.2","TCP","1514","52142  >  34567 [ACK] Seq=256897 Ack=1 Win=29696 Len=1448 TSval=1361053 TSecr=1361027"
"224","8.688419325","10.0.0.2","10.0.0.1","TCP","66","34567  >  52142 [ACK] Seq=1 Ack=251105 Win=170496 Len=0 TSval=1361069 TSecr=1361037"
"225","8.729797740","10.0.0.2","10.0.0.1","TCP","66","34567  >  52142 [ACK] Seq=1 Ack=254001 Win=170496 Len=0 TSval=1361079 TSecr=1361048"
"226","8.755379188","10.0.0.2","10.0.0.1","TCP","66","34567  >  52142 [ACK] Seq=1 Ack=256897 Win=170496 Len=0 TSval=1361085 TSecr=1361053"
"227","8.763710832","10.0.0.1","10.0.0.2","TCP","2962","52142  >  34567 [ACK] Seq=258345 Ack=1 Win=29696 Len=2896 TSval=1361094 TSecr=1361069"
"228","8.804595213","10.0.0.1","10.0.0.2","TCP","2962","52142  >  34567 [ACK] Seq=261241 Ack=1 Win=29696 Len=2896 TSval=1361105 TSecr=1361079"
"229","8.825824057","10.0.0.2","10.0.0.1","TCP","66","34567  >  52142 [ACK] Seq=1 Ack=258345 Win=170496 Len=0 TSval=1361104 TSecr=1361053"
"230","8.829900678","10.0.0.1","10.0.0.2","TCP","2962","52142  >  34567 [ACK] Seq=264137 Ack=1 Win=29696 Len=2896 TSval=1361111 TSecr=1361085"
"231","8.890734972","10.0.0.1","10.0.0.2","TCP","1514","52142  >  34567 [ACK] Seq=267033 Ack=1 Win=29696 Len=1448 TSval=1361129 TSecr=1361104"
"232","8.928504833","10.0.0.2","10.0.0.1","TCP","66","34567  >  52142 [ACK] Seq=1 Ack=261241 Win=170496 Len=0 TSval=1361127 TSecr=1361094"
"233","8.957621085","10.0.0.2","10.0.0.1","TCP","66","34567  >  52142 [ACK] Seq=1 Ack=264137 Win=170496 Len=0 TSval=1361136 TSecr=1361105"
"234","8.983148766","10.0.0.2","10.0.0.1","TCP","66","34567  >  52142 [ACK] Seq=1 Ack=267033 Win=170496 Len=0 TSval=1361142 TSecr=1361111"
"235","9.003055717","10.0.0.1","10.0.0.2","TCP","2962","52142  >  34567 [ACK] Seq=268481 Ack=1 Win=29696 Len=2896 TSval=1361154 TSecr=1361127"
"236","9.032768544","10.0.0.1","10.0.0.2","TCP","2962","52142  >  34567 [ACK] Seq=271377 Ack=1 Win=29696 Len=2896 TSval=1361162 TSecr=1361136"
"237","9.057554713","10.0.0.1","10.0.0.2","TCP","2962","52142  >  34567 [ACK] Seq=274273 Ack=1 Win=29696 Len=2896 TSval=1361168 TSecr=1361142"
"238","9.143593489","10.0.0.2","10.0.0.1","TCP","66","34567  >  52142 [ACK] Seq=1 Ack=268481 Win=170496 Len=0 TSval=1361183 TSecr=1361129"
"239","9.156766465","10.0.0.2","10.0.0.1","TCP","66","34567  >  52142 [ACK] Seq=1 Ack=271377 Win=170496 Len=0 TSval=1361186 TSecr=1361154"
"240","9.184427505","10.0.0.2","10.0.0.1","TCP","66","34567  >  52142 [ACK] Seq=1 Ack=274273 Win=170496 Len=0 TSval=1361193 TSecr=1361162"
"241","9.206631188","10.0.0.1","10.0.0.2","TCP","1514","52142  >  34567 [ACK] Seq=277169 Ack=1 Win=29696 Len=1448 TSval=1361208 TSecr=1361183"
"242","9.209863143","10.0.0.2","10.0.0.1","TCP","66","34567  >  52142 [ACK] Seq=1 Ack=277169 Win=170496 Len=0 TSval=1361199 TSecr=1361168"
"243","9.231527315","10.0.0.1","10.0.0.2","TCP","2962","52142  >  34567 [ACK] Seq=278617 Ack=1 Win=29696 Len=2896 TSval=1361211 TSecr=1361186"
"244","9.258806568","10.0.0.1","10.0.0.2","TCP","2962","52142  >  34567 [ACK] Seq=281513 Ack=1 Win=29696 Len=2896 TSval=1361218 TSecr=1361193"
"245","9.291793047","10.0.0.1","10.0.0.2","TCP","2962","52142  >  34567 [ACK] Seq=284409 Ack=1 Win=29696 Len=2896 TSval=1361225 TSecr=1361199"
"246","9.384112136","10.0.0.2","10.0.0.1","TCP","66","34567  >  52142 [ACK] Seq=1 Ack=281513 Win=170496 Len=0 TSval=1361243 TSecr=1361208"
"247","9.411394010","10.0.0.2","10.0.0.1","TCP","66","34567  >  52142 [ACK] Seq=1 Ack=284409 Win=170496 Len=0 TSval=1361250 TSecr=1361218"
"248","9.445294167","10.0.0.2","10.0.0.1","TCP","66","34567  >  52142 [ACK] Seq=1 Ack=287305 Win=170496 Len=0 TSval=1361258 TSecr=1361225"
"249","9.461541752","10.0.0.1","10.0.0.2","TCP","2962","52142  >  34567 [ACK] Seq=287305 Ack=1 Win=29696 Len=2896 TSval=1361268 TSecr=1361243"
"250","9.486662073","10.0.0.1","10.0.0.2","TCP","2962","52142  >  34567 [ACK] Seq=290201 Ack=1 Win=29696 Len=2896 TSval=1361275 TSecr=1361250"
"251","9.520859993","10.0.0.1","10.0.0.2","TCP","2962","52142  >  34567 [ACK] Seq=293097 Ack=1 Win=29696 Len=2896 TSval=1361284 TSecr=1361258"
"252","9.532401511","10.0.0.1","10.0.0.2","TCP","1514","52142  >  34567 [ACK] Seq=295993 Ack=1 Win=29696 Len=1448 TSval=1361284 TSecr=1361258"
"253","9.618519665","10.0.0.2","10.0.0.1","TCP","66","34567  >  52142 [ACK] Seq=1 Ack=290201 Win=170496 Len=0 TSval=1361300 TSecr=1361268"
"254","9.638550610","10.0.0.2","10.0.0.1","TCP","66","34567  >  52142 [ACK] Seq=1 Ack=293097 Win=170496 Len=0 TSval=1361306 TSecr=1361275"
"255","9.688827024","10.0.0.2","10.0.0.1","TCP","66","34567  >  52142 [ACK] Seq=1 Ack=295993 Win=170496 Len=0 TSval=1361315 TSecr=1361284"
"256","9.694535030","10.0.0.1","10.0.0.2","TCP","2962","52142  >  34567 [ACK] Seq=297441 Ack=1 Win=29696 Len=2896 TSval=1361327 TSecr=1361300"
"257","9.718861326","10.0.0.1","10.0.0.2","TCP","2962","52142  >  34567 [ACK] Seq=300337 Ack=1 Win=29696 Len=2896 TSval=1361332 TSecr=1361306"
"258","9.739349222","10.0.0.2","10.0.0.1","TCP","66","34567  >  52142 [ACK] Seq=1 Ack=297441 Win=170496 Len=0 TSval=1361332 TSecr=1361284"
"259","9.764861110","10.0.0.1","10.0.0.2","TCP","2962","52142  >  34567 [ACK] Seq=303233 Ack=1 Win=29696 Len=2896 TSval=1361344 TSecr=1361315"
"260","9.814981471","10.0.0.1","10.0.0.2","TCP","2962","52142  >  34567 [ACK] Seq=306129 Ack=1 Win=29696 Len=2896 TSval=1361357 TSecr=1361332"
"261","9.847378531","10.0.0.2","10.0.0.1","TCP","66","34567  >  52142 [ACK] Seq=1 Ack=300337 Win=170496 Len=0 TSval=1361359 TSecr=1361327"
"262","9.874063944","10.0.0.2","10.0.0.1","TCP","66","34567  >  52142 [ACK] Seq=1 Ack=303233 Win=170496 Len=0 TSval=1361365 TSecr=1361332"
"263","9.916311193","10.0.0.2","10.0.0.1","TCP","66","34567  >  52142 [ACK] Seq=1 Ack=306129 Win=170496 Len=0 TSval=1361376 TSecr=1361344"
"264","9.949819599","10.0.0.1","10.0.0.2","TCP","2962","[TCP Previous segment not captured] 52142  >  34567 [ACK] Seq=311921 Ack=1 Win=29696 Len=2896 TSval=1361391 TSecr=1361365"
"265","9.968200219","10.0.0.2","10.0.0.1","TCP","66","34567  >  52142 [ACK] Seq=1 Ack=309025 Win=170496 Len=0 TSval=1361389 TSecr=1361357"
"266","9.992316851","10.0.0.1","10.0.0.2","TCP","2962","52142  >  34567 [ACK] Seq=314817 Ack=1 Win=29696 Len=2896 TSval=1361401 TSecr=1361376"
"267","10.043535972","10.0.0.1","10.0.0.2","TCP","2962","52142  >  34567 [ACK] Seq=317713 Ack=1 Win=29696 Len=2896 TSval=1361414 TSecr=1361389"
"268","10.103231883","10.0.0.2","10.0.0.1","TCP","78","[TCP Dup ACK 265#1] 34567  >  52142 [ACK] Seq=1 Ack=309025 Win=170496 Len=0 TSval=1361423 TSecr=1361357 SLE=311921 SRE=314817"
"269","10.145309076","10.0.0.2","10.0.0.1","TCP","78","[TCP Dup ACK 265#2] 34567  >  52142 [ACK] Seq=1 Ack=309025 Win=170496 Len=0 TSval=1361433 TSecr=1361357 SLE=311921 SRE=317713"
"270","10.165970177","10.0.0.1","10.0.0.2","TCP","1514","[TCP Out-Of-Order] 52142  >  34567 [ACK] Seq=309025 Ack=1 Win=29696 Len=1448 TSval=1361448 TSecr=1361423"
