"No.","Time","Source","Destination","Protocol","Length","Info"
"1","0.000000000","10.0.0.1","10.0.0.2","TCP","74","52142  >  34567 [SYN] Seq=0 Win=29200 Len=0 MSS=1460 SACK_PERM=1 TSval=1358909 TSecr=0 WS=512"
"2","34.189045659","10.0.0.3","10.0.0.2","TCP","74","38144  >  34568 [SYN] Seq=0 Win=29200 Len=0 MSS=1460 SACK_PERM=1 TSval=1367469 TSecr=0 WS=512"
"3","34.344907136","10.0.0.2","10.0.0.3","TCP","74","34568  >  38144 [SYN, ACK] Seq=0 Ack=1 Win=28960 Len=0 MSS=1460 SACK_PERM=1 TSval=1367496 TSecr=1367469 WS=512"
"4","34.397652296","10.0.0.3","10.0.0.2","TCP","66","38144  >  34568 [ACK] Seq=1 Ack=1 Win=29696 Len=0 TSval=1367521 TSecr=1367496"
"5","34.413910976","10.0.0.3","10.0.0.2","TCP","2114","38144  >  34568 [PSH, ACK] Seq=1 Ack=1 Win=29696 Len=2048 TSval=1367521 TSecr=1367496"
"6","34.426191963","10.0.0.3","10.0.0.2","TCP","1514","38144  >  34568 [ACK] Seq=2049 Ack=1 Win=29696 Len=1448 TSval=1367521 TSecr=1367496"
"7","34.437766188","10.0.0.3","10.0.0.2","TCP","1514","38144  >  34568 [ACK] Seq=3497 Ack=1 Win=29696 Len=1448 TSval=1367521 TSecr=1367496"
"8","34.462985825","10.0.0.3","10.0.0.2","TCP","2962","38144  >  34568 [ACK] Seq=4945 Ack=1 Win=29696 Len=2896 TSval=1367521 TSecr=1367496"
"9","34.475676496","10.0.0.3","10.0.0.2","TCP","1514","38144  >  34568 [ACK] Seq=7841 Ack=1 Win=29696 Len=1448 TSval=1367521 TSecr=1367496"
"10","34.499428047","10.0.0.3","10.0.0.2","TCP","2962","38144  >  34568 [ACK] Seq=9289 Ack=1 Win=29696 Len=2896 TSval=1367521 TSecr=1367496"
"11","34.511123488","10.0.0.3","10.0.0.2","TCP","1514","38144  >  34568 [ACK] Seq=12185 Ack=1 Win=29696 Len=1448 TSval=1367521 TSecr=1367496"
"12","34.566340211","10.0.0.2","10.0.0.3","TCP","66","34568  >  38144 [ACK] Seq=1 Ack=2049 Win=33280 Len=0 TSval=1367551 TSecr=1367521"
"13","34.580939418","10.0.0.2","10.0.0.3","TCP","66","34568  >  38144 [ACK] Seq=1 Ack=3497 Win=36352 Len=0 TSval=1367555 TSecr=1367521"
"14","34.594757686","10.0.0.2","10.0.0.3","TCP","66","34568  >  38144 [ACK] Seq=1 Ack=4945 Win=38912 Len=0 TSval=1367557 TSecr=1367521"
"15","34.624661481","10.0.0.2","10.0.0.3","TCP","66","34568  >  38144 [ACK] Seq=1 Ack=7841 Win=45056 Len=0 TSval=1367564 TSecr=1367521"
"16","34.628500515","10.0.0.2","10.0.0.3","TCP","66","34568  >  38144 [ACK] Seq=1 Ack=9289 Win=47616 Len=0 TSval=1367567 TSecr=1367521"
"17","34.640921010","10.0.0.3","10.0.0.2","TCP","2962","[TCP Previous segment not captured] 38144  >  34568 [ACK] Seq=16529 Ack=1 Win=29696 Len=2896 TSval=1367577 TSecr=1367551"
"18","34.655413795","10.0.0.2","10.0.0.3","TCP","66","34568  >  38144 [ACK] Seq=1 Ack=12185 Win=53760 Len=0 TSval=1367573 TSecr=1367521"
"19","34.666396738","10.0.0.3","10.0.0.2","TCP","2962","38144  >  34568 [ACK] Seq=19425 Ack=1 Win=29696 Len=2896 TSval=1367580 TSecr=1367555"
"20","34.677039288","10.0.0.2","10.0.0.3","TCP","66","34568  >  38144 [ACK] Seq=1 Ack=13633 Win=56320 Len=0 TSval=1367579 TSecr=1367521"
"21","34.689249875","10.0.0.3","10.0.0.2","TCP","2962","38144  >  34568 [ACK] Seq=22321 Ack=1 Win=29696 Len=2896 TSval=1367584 TSecr=1367557"
"22","34.714669956","10.0.0.3","10.0.0.2","TCP","2962","38144  >  34568 [ACK] Seq=25217 Ack=1 Win=29696 Len=2896 TSval=1367591 TSecr=1367564"
"23","34.738207489","10.0.0.3","10.0.0.2","TCP","2962","38144  >  34568 [ACK] Seq=28113 Ack=1 Win=29696 Len=2896 TSval=1367591 TSecr=1367564"
"24","34.762638277","10.0.0.3","10.0.0.2","TCP","2962","38144  >  34568 [ACK] Seq=31009 Ack=1 Win=29696 Len=2896 TSval=1367592 TSecr=1367567"
"25","34.786278737","10.0.0.3","10.0.0.2","TCP","2962","38144  >  34568 [ACK] Seq=33905 Ack=1 Win=29696 Len=2896 TSval=1367599 TSecr=1367573"
"26","34.802439492","10.0.0.2","10.0.0.3","TCP","78","[TCP Window Update] 34568  >  38144 [ACK] Seq=1 Ack=13633 Win=62464 Len=0 TSval=1367608 TSecr=1367521 SLE=16529 SRE=19425"
"27","34.811059462","10.0.0.3","10.0.0.2","TCP","2962","38144  >  34568 [ACK] Seq=36801 Ack=1 Win=29696 Len=2896 TSval=1367599 TSecr=1367573"
"28","34.821759458","10.0.0.2","10.0.0.3","TCP","78","[TCP Window Update] 34568  >  38144 [ACK] Seq=1 Ack=13633 Win=68096 Len=0 TSval=1367615 TSecr=1367521 SLE=16529 SRE=22321"
"29","34.835069305","10.0.0.3","10.0.0.2","TCP","2962","38144  >  34568 [ACK] Seq=39697 Ack=1 Win=29696 Len=2896 TSval=1367604 TSecr=1367579"
"30","34.840911261","10.0.0.2","10.0.0.3","TCP","78","[TCP Window Update] 34568  >  38144 [ACK] Seq=1 Ack=13633 Win=73728 Len=0 TSval=1367620 TSecr=1367521 SLE=16529 SRE=25217"
"31","34.866140235","10.0.0.3","10.0.0.2","TCP","1514","[TCP Out-Of-Order] 38144  >  34568 [ACK] Seq=13633 Ack=1 Win=29696 Len=1448 TSval=1367636 TSecr=1367608"
"32","34.866149733","10.0.0.2","10.0.0.3","TCP","78","[TCP Window Update] 34568  >  38144 [ACK] Seq=1 Ack=13633 Win=79872 Len=0 TSval=1367626 TSecr=1367521 SLE=16529 SRE=28113"
"33","34.877484108","10.0.0.3","10.0.0.2","TCP","1514","38144  >  34568 [ACK] Seq=42593 Ack=1 Win=29696 Len=1448 TSval=1367636 TSecr=1367608"
"34","34.889655456","10.0.0.3","10.0.0.2","TCP","1514","[TCP Out-Of-Order] 38144  >  34568 [ACK] Seq=15081 Ack=1 Win=29696 Len=1448 TSval=1367640 TSecr=1367615"
"35","34.904778632","10.0.0.2","10.0.0.3","TCP","78","[TCP Window Update] 34568  >  38144 [ACK] Seq=1 Ack=13633 Win=85504 Len=0 TSval=1367636 TSecr=1367521 SLE=16529 SRE=31009"
"36","34.916186076","10.0.0.3","10.0.0.2","TCP","2962","38144  >  34568 [ACK] Seq=44041 Ack=1 Win=29696 Len=2896 TSval=1367645 TSecr=1367620"
"37","34.935842383","10.0.0.3","10.0.0.2","TCP","1514","38144  >  34568 [ACK] Seq=46937 Ack=1 Win=29696 Len=1448 TSval=1367652 TSecr=1367626"
"38","34.935849630","10.0.0.2","10.0.0.3","TCP","78","[TCP Window Update] 34568  >  38144 [ACK] Seq=1 Ack=13633 Win=91136 Len=0 TSval=1367642 TSecr=1367521 SLE=16529 SRE=33905"
"39","34.956416308","10.0.0.2","10.0.0.3","TCP","78","[TCP Window Update] 34568  >  38144 [ACK] Seq=1 Ack=13633 Win=96768 Len=0 TSval=1367648 TSecr=1367521 SLE=16529 SRE=36801"
"40","34.986020458","10.0.0.2","10.0.0.3","TCP","78","[TCP Window Update] 34568  >  38144 [ACK] Seq=1 Ack=13633 Win=102912 Len=0 TSval=1367654 TSecr=1367521 SLE=16529 SRE=39697"
"41","35.010690345","10.0.0.3","10.0.0.2","TCP","2962","38144  >  34568 [ACK] Seq=48385 Ack=1 Win=29696 Len=2896 TSval=1367669 TSecr=1367642"
"42","35.017494639","10.0.0.2","10.0.0.3","TCP","78","[TCP Window Update] 34568  >  38144 [ACK] Seq=1 Ack=13633 Win=108544 Len=0 TSval=1367664 TSecr=1367521 SLE=16529 SRE=42593"
"43","35.036426528","10.0.0.3","10.0.0.2","TCP","2962","38144  >  34568 [ACK] Seq=51281 Ack=1 Win=29696 Len=2896 TSval=1367674 TSecr=1367648"
"44","35.038315798","10.0.0.2","10.0.0.3","TCP","78","34568  >  38144 [ACK] Seq=1 Ack=15081 Win=111616 Len=0 TSval=1367669 TSecr=1367636 SLE=16529 SRE=42593"
"45","35.056445959","10.0.0.2","10.0.0.3","TCP","78","[TCP Window Update] 34568  >  38144 [ACK] Seq=1 Ack=15081 Win=114176 Len=0 TSval=1367674 TSecr=1367636 SLE=16529 SRE=44041"
"46","35.064950893","10.0.0.2","10.0.0.3","TCP","66","34568  >  38144 [ACK] Seq=1 Ack=44041 Win=117248 Len=0 TSval=1367676 TSecr=1367640"
"47","35.075194975","10.0.0.2","10.0.0.3","TCP","66","34568  >  38144 [ACK] Seq=1 Ack=46937 Win=122880 Len=0 TSval=1367678 TSecr=1367645"
"48","35.092680821","10.0.0.3","10.0.0.2","TCP","2962","[TCP Previous segment not captured] 38144  >  34568 [ACK] Seq=57073 Ack=1 Win=29696 Len=2896 TSval=1367689 TSecr=1367664"
"49","35.098999295","10.0.0.2","10.0.0.3","TCP","66","34568  >  38144 [ACK] Seq=1 Ack=48385 Win=125952 Len=0 TSval=1367684 TSecr=1367652"
"50","35.104818080","10.0.0.3","10.0.0.2","TCP","1514","38144  >  34568 [ACK] Seq=59969 Ack=1 Win=29696 Len=1448 TSval=1367695 TSecr=1367669"
"51","35.120353828","10.0.0.3","10.0.0.2","TCP","1514","38144  >  34568 [ACK] Seq=61417 Ack=1 Win=29696 Len=1448 TSval=1367699 TSecr=1367674"
"52","35.151093643","10.0.0.3","10.0.0.2","TCP","2962","[TCP Previous segment not captured] 38144  >  34568 [ACK] Seq=65761 Ack=1 Win=29696 Len=2896 TSval=1367704 TSecr=1367678"
"53","35.164361054","10.0.0.2","10.0.0.3","TCP","66","34568  >  38144 [ACK] Seq=1 Ack=51281 Win=131584 Len=0 TSval=1367701 TSecr=1367669"
"54","35.174921808","10.0.0.3","10.0.0.2","TCP","2962","38144  >  34568 [ACK] Seq=68657 Ack=1 Win=29696 Len=2896 TSval=1367710 TSecr=1367684"
"55","35.190462803","10.0.0.2","10.0.0.3","TCP","66","34568  >  38144 [ACK] Seq=1 Ack=54177 Win=137728 Len=0 TSval=1367707 TSecr=1367674"
"56","35.246604122","10.0.0.3","10.0.0.2","TCP","2962","38144  >  34568 [ACK] Seq=71553 Ack=1 Win=29696 Len=2896 TSval=1367726 TSecr=1367701"
"57","35.246617522","10.0.0.2","10.0.0.3","TCP","78","[TCP Window Update] 34568  >  38144 [ACK] Seq=1 Ack=54177 Win=143360 Len=0 TSval=1367721 TSecr=1367674 SLE=57073 SRE=59969"
"58","35.257718191","10.0.0.2","10.0.0.3","TCP","78","[TCP Window Update] 34568  >  38144 [ACK] Seq=1 Ack=54177 Win=146432 Len=0 TSval=1367724 TSecr=1367674 SLE=57073 SRE=61417"
"59","35.267489636","10.0.0.3","10.0.0.2","TCP","2962","38144  >  34568 [ACK] Seq=74449 Ack=1 Win=29696 Len=2896 TSval=1367733 TSecr=1367707"
"60","35.275336413","10.0.0.2","10.0.0.3","TCP","78","[TCP Window Update] 34568  >  38144 [ACK] Seq=1 Ack=54177 Win=148992 Len=0 TSval=1367728 TSecr=1367674 SLE=57073 SRE=62865"
"61","35.304996904","10.0.0.2","10.0.0.3","TCP","86","[TCP Window Update] 34568  >  38144 [ACK] Seq=1 Ack=54177 Win=155136 Len=0 TSval=1367736 TSecr=1367674 SLE=65761 SRE=68657 SLE=57073 SRE=62865"
"62","35.309707836","10.0.0.3","10.0.0.2","TCP","1514","[TCP Out-Of-Order] 38144  >  34568 [ACK] Seq=54177 Ack=1 Win=29696 Len=1448 TSval=1367747 TSecr=1367721"
"63","35.321246478","10.0.0.3","10.0.0.2","TCP","1514","38144  >  34568 [ACK] Seq=77345 Ack=1 Win=29696 Len=1448 TSval=1367747 TSecr=1367721"
"64","35.329795127","10.0.0.2","10.0.0.3","TCP","86","[TCP Window Update] 34568  >  38144 [ACK] Seq=1 Ack=54177 Win=160768 Len=0 TSval=1367742 TSecr=1367674 SLE=65761 SRE=71553 SLE=57073 SRE=62865"
"65","35.333594001","10.0.0.3","10.0.0.2","TCP","1514","[TCP Out-Of-Order] 38144  >  34568 [ACK] Seq=55625 Ack=1 Win=29696 Len=1448 TSval=1367749 TSecr=1367724"
"66","35.369222944","10.0.0.3","10.0.0.2","TCP","1514","[TCP Out-Of-Order] 38144  >  34568 [ACK] Seq=62865 Ack=1 Win=29696 Len=1448 TSval=1367761 TSecr=1367736"
"67","35.380199354","10.0.0.3","10.0.0.2","TCP","1514","[TCP Out-Of-Order] 38144  >  34568 [ACK] Seq=64313 Ack=1 Win=29696 Len=1448 TSval=1367761 TSecr=1367736"
"68","35.400454176","10.0.0.2","10.0.0.3","TCP","86","[TCP Window Update] 34568  >  38144 [ACK] Seq=1 Ack=54177 Win=162816 Len=0 TSval=1367759 TSecr=1367674 SLE=65761 SRE=74449 SLE=57073 SRE=62865"
"69","35.406001566","10.0.0.3","10.0.0.2","TCP","2962","38144  >  34568 [ACK] Seq=78793 Ack=1 Win=29696 Len=2896 TSval=1367768 TSecr=1367742"
"70","35.420484012","10.0.0.2","10.0.0.3","TCP","86","[TCP Dup ACK 55#1] 34568  >  38144 [ACK] Seq=1 Ack=54177 Win=162816 Len=0 TSval=1367765 TSecr=1367674 SLE=65761 SRE=77345 SLE=57073 SRE=62865"
"71","35.463164997","10.0.0.2","10.0.0.3","TCP","86","34568  >  38144 [ACK] Seq=1 Ack=55625 Win=161792 Len=0 TSval=1367775 TSecr=1367747 SLE=65761 SRE=77345 SLE=57073 SRE=62865"
"72","35.474068075","10.0.0.2","10.0.0.3","TCP","86","[TCP Dup ACK 71#1] 34568  >  38144 [ACK] Seq=1 Ack=55625 Win=161792 Len=0 TSval=1367778 TSecr=1367747 SLE=65761 SRE=78793 SLE=57073 SRE=62865"
"73","35.490914263","10.0.0.2","10.0.0.3","TCP","78","34568  >  38144 [ACK] Seq=1 Ack=62865 Win=159744 Len=0 TSval=1367781 TSecr=1367749 SLE=65761 SRE=78793"
"74","35.496415944","10.0.0.3","10.0.0.2","TCP","2962","[TCP Previous segment not captured] 38144  >  34568 [ACK] Seq=84585 Ack=1 Win=29696 Len=2896 TSval=1367790 TSecr=1367765"
"75","35.524326675","10.0.0.2","10.0.0.3","TCP","78","34568  >  38144 [ACK] Seq=1 Ack=64313 Win=162816 Len=0 TSval=1367790 TSecr=1367761 SLE=65761 SRE=78793"
"76","35.526112279","10.0.0.3","10.0.0.2","TCP","1514","38144  >  34568 [ACK] Seq=87481 Ack=1 Win=29696 Len=1448 TSval=1367801 TSecr=1367775"
"77","35.534409266","10.0.0.2","10.0.0.3","TCP","66","34568  >  38144 [ACK] Seq=1 Ack=78793 Win=163840 Len=0 TSval=1367793 TSecr=1367761"
"78","35.538427539","10.0.0.3","10.0.0.2","TCP","1514","38144  >  34568 [ACK] Seq=88929 Ack=1 Win=29696 Len=1448 TSval=1367804 TSecr=1367778"
"79","35.554995072","10.0.0.3","10.0.0.2","TCP","1514","38144  >  34568 [ACK] Seq=90377 Ack=1 Win=29696 Len=1448 TSval=1367808 TSecr=1367781"
"80","35.560630966","10.0.0.2","10.0.0.3","TCP","66","34568  >  38144 [ACK] Seq=1 Ack=81689 Win=170496 Len=0 TSval=1367800 TSecr=1367768"
"81","35.587568512","10.0.0.3","10.0.0.2","TCP","1514","38144  >  34568 [ACK] Seq=91825 Ack=1 Win=29696 Len=1448 TSval=1367816 TSecr=1367790"
"82","35.598875984","10.0.0.3","10.0.0.2","TCP","1514","38144  >  34568 [ACK] Seq=93273 Ack=1 Win=29696 Len=1448 TSval=1367819 TSecr=1367793"
"83","35.635358237","10.0.0.3","10.0.0.2","TCP","2962","38144  >  34568 [ACK] Seq=94721 Ack=1 Win=29696 Len=2896 TSval=1367825 TSecr=1367800"
"84","35.650703391","10.0.0.2","10.0.0.3","TCP","78","[TCP Dup ACK 80#1] 34568  >  38144 [ACK] Seq=1 Ack=81689 Win=170496 Len=0 TSval=1367822 TSecr=1367768 SLE=84585 SRE=87481"
"85","35.681758521","10.0.0.2","10.0.0.3","TCP","78","[TCP Dup ACK 80#2] 34568  >  38144 [ACK] Seq=1 Ack=81689 Win=170496 Len=0 TSval=1367830 TSecr=1367768 SLE=84585 SRE=88929"
"86","35.702317422","10.0.0.2","10.0.0.3","TCP","78","[TCP Dup ACK 80#3] 34568  >  38144 [ACK] Seq=1 Ack=81689 Win=170496 Len=0 TSval=1367835 TSecr=1367768 SLE=84585 SRE=90377"
"87","35.712468024","10.0.0.2","10.0.0.3","TCP","78","[TCP Dup ACK 80#4] 34568  >  38144 [ACK] Seq=1 Ack=81689 Win=170496 Len=0 TSval=1367837 TSecr=1367768 SLE=84585 SRE=91825"
"88","35.721720541","10.0.0.3","10.0.0.2","TCP","1514","[TCP Fast Retransmission] 38144  >  34568 [ACK] Seq=81689 Ack=1 Win=29696 Len=1448 TSval=1367848 TSecr=1367822"
"89","35.742964559","10.0.0.2","10.0.0.3","TCP","78","[TCP Dup ACK 80#5] 34568  >  38144 [ACK] Seq=1 Ack=81689 Win=170496 Len=0 TSval=1367845 TSecr=1367768 SLE=84585 SRE=93273"
"90","35.748464628","10.0.0.3","10.0.0.2","TCP","1514","[TCP Out-Of-Order] 38144  >  34568 [ACK] Seq=83137 Ack=1 Win=29696 Len=1448 TSval=1367855 TSecr=1367830"
"91","35.752686335","10.0.0.2","10.0.0.3","TCP","78","[TCP Dup ACK 80#6] 34568  >  38144 [ACK] Seq=1 Ack=81689 Win=170496 Len=0 TSval=1367848 TSecr=1367768 SLE=84585 SRE=94721"
"92","35.765555395","10.0.0.3","10.0.0.2","TCP","1514","38144  >  34568 [ACK] Seq=97617 Ack=1 Win=29696 Len=1448 TSval=1367861 TSecr=1367835"
"93","35.778642862","10.0.0.3","10.0.0.2","TCP","1514","38144  >  34568 [ACK] Seq=99065 Ack=1 Win=29696 Len=1448 TSval=1367863 TSecr=1367837"
"94","35.793539489","10.0.0.2","10.0.0.3","TCP","78","[TCP Dup ACK 80#7] 34568  >  38144 [ACK] Seq=1 Ack=81689 Win=170496 Len=0 TSval=1367857 TSecr=1367768 SLE=84585 SRE=97617"
"95","35.816848929","10.0.0.3","10.0.0.2","TCP","1514","[TCP Previous segment not captured] 38144  >  34568 [ACK] Seq=101961 Ack=1 Win=29696 Len=1448 TSval=1367873 TSecr=1367848"
"96","35.868417523","10.0.0.3","10.0.0.2","TCP","2962","38144  >  34568 [ACK] Seq=103409 Ack=1 Win=29696 Len=2896 TSval=1367883 TSecr=1367857"
"97","35.877758571","10.0.0.2","10.0.0.3","TCP","78","34568  >  38144 [ACK] Seq=1 Ack=83137 Win=169472 Len=0 TSval=1367879 TSecr=1367848 SLE=84585 SRE=97617"
"98","35.903747500","10.0.0.2","10.0.0.3","TCP","66","34568  >  38144 [ACK] Seq=1 Ack=97617 Win=165376 Len=0 TSval=1367885 TSecr=1367855"
"99","35.934695347","10.0.0.2","10.0.0.3","TCP","66","34568  >  38144 [ACK] Seq=1 Ack=100513 Win=170496 Len=0 TSval=1367893 TSecr=1367861"
"100","35.941666587","10.0.0.3","10.0.0.2","TCP","1514","38144  >  34568 [ACK] Seq=106305 Ack=1 Win=29696 Len=1448 TSval=1367905 TSecr=1367879"
"101","35.970168627","10.0.0.2","10.0.0.3","TCP","78","[TCP Dup ACK 99#1] 34568  >  38144 [ACK] Seq=1 Ack=100513 Win=170496 Len=0 TSval=1367902 TSecr=1367861 SLE=101961 SRE=103409"
"102","35.978814278","10.0.0.3","10.0.0.2","TCP","2962","38144  >  34568 [ACK] Seq=107753 Ack=1 Win=29696 Len=2896 TSval=1367911 TSecr=1367885"
"103","36.009448366","10.0.0.3","10.0.0.2","TCP","2962","38144  >  34568 [ACK] Seq=110649 Ack=1 Win=29696 Len=2896 TSval=1367919 TSecr=1367893"
"104","36.021085711","10.0.0.2","10.0.0.3","TCP","78","[TCP Dup ACK 99#2] 34568  >  38144 [ACK] Seq=1 Ack=100513 Win=170496 Len=0 TSval=1367915 TSecr=1367861 SLE=101961 SRE=106305"
"105","36.087368328","10.0.0.3","10.0.0.2","TCP","1514","[TCP Out-Of-Order] 38144  >  34568 [ACK] Seq=100513 Ack=1 Win=29696 Len=1448 TSval=1367940 TSecr=1367915"
"106","36.097621342","10.0.0.2","10.0.0.3","TCP","78","[TCP Dup ACK 99#3] 34568  >  38144 [ACK] Seq=1 Ack=100513 Win=170496 Len=0 TSval=1367933 TSecr=1367861 SLE=101961 SRE=107753"
"107","36.138992279","10.0.0.2","10.0.0.3","TCP","78","[TCP Dup ACK 99#4] 34568  >  38144 [ACK] Seq=1 Ack=100513 Win=170496 Len=0 TSval=1367942 TSecr=1367861 SLE=101961 SRE=110649"
"108","36.167719252","10.0.0.2","10.0.0.3","TCP","78","[TCP Dup ACK 99#5] 34568  >  38144 [ACK] Seq=1 Ack=100513 Win=170496 Len=0 TSval=1367952 TSecr=1367861 SLE=101961 SRE=113545"
"109","36.216005240","10.0.0.3","10.0.0.2","TCP","2962","[TCP Previous segment not captured] 38144  >  34568 [ACK] Seq=114993 Ack=1 Win=29696 Len=2896 TSval=1367970 TSecr=1367942"
"110","36.241790658","10.0.0.2","10.0.0.3","TCP","66","34568  >  38144 [ACK] Seq=1 Ack=113545 Win=165888 Len=0 TSval=1367970 TSecr=1367940"
"111","36.305561480","10.0.0.3","10.0.0.2","TCP","1514","[TCP Previous segment not captured] 38144  >  34568 [ACK] Seq=120785 Ack=1 Win=29696 Len=1448 TSval=1367996 TSecr=1367970"
"112","36.378439614","10.0.0.2","10.0.0.3","TCP","78","[TCP Window Update] 34568  >  38144 [ACK] Seq=1 Ack=113545 Win=170496 Len=0 TSval=1368002 TSecr=1367940 SLE=114993 SRE=117889"
"113","36.453062871","10.0.0.3","10.0.0.2","TCP","2962","38144  >  34568 [ACK] Seq=122233 Ack=1 Win=29696 Len=2896 TSval=1368030 TSecr=1368002"
"114","36.458282171","10.0.0.2","10.0.0.3","TCP","86","[TCP Dup ACK 110#1] 34568  >  38144 [ACK] Seq=1 Ack=113545 Win=170496 Len=0 TSval=1368024 TSecr=1367940 SLE=120785 SRE=122233 SLE=114993 SRE=117889"
"115","36.520966843","10.0.0.3","10.0.0.2","TCP","1514","[TCP Out-Of-Order] 38144  >  34568 [ACK] Seq=117889 Ack=1 Win=29696 Len=1448 TSval=1368050 TSecr=1368024"
"116","36.616115269","10.0.0.2","10.0.0.3","TCP","86","[TCP Dup ACK 110#2] 34568  >  38144 [ACK] Seq=1 Ack=113545 Win=170496 Len=0 TSval=1368064 TSecr=1367940 SLE=120785 SRE=125129 SLE=114993 SRE=117889"
"117","36.675296966","10.0.0.2","10.0.0.3","TCP","86","[TCP Dup ACK 110#3] 34568  >  38144 [ACK] Seq=1 Ack=113545 Win=170496 Len=0 TSval=1368078 TSecr=1367940 SLE=114993 SRE=119337 SLE=120785 SRE=125129"
"118","36.679365287","10.0.0.3","10.0.0.2","TCP","1514","[TCP Fast Retransmission] 38144  >  34568 [ACK] Seq=113545 Ack=1 Win=29696 Len=1448 TSval=1368089 TSecr=1368064"
"119","36.739880155","10.0.0.3","10.0.0.2","TCP","1514","38144  >  34568 [ACK] Seq=125129 Ack=1 Win=29696 Len=1448 TSval=1368104 TSecr=1368078"
"120","36.837138475","10.0.0.2","10.0.0.3","TCP","78","34568  >  38144 [ACK] Seq=1 Ack=119337 Win=165376 Len=0 TSval=1368118 TSecr=1368089 SLE=120785 SRE=125129"
"121","36.899530184","10.0.0.2","10.0.0.3","TCP","78","[TCP Window Update] 34568  >  38144 [ACK] Seq=1 Ack=119337 Win=168448 Len=0 TSval=1368133 TSecr=1368089 SLE=120785 SRE=126577"
"122","36.913309268","10.0.0.3","10.0.0.2","TCP","2962","38144  >  34568 [ACK] Seq=126577 Ack=1 Win=29696 Len=2896 TSval=1368144 TSecr=1368118"
"123","36.962016120","10.0.0.3","10.0.0.2","TCP","1514","[TCP Out-Of-Order] 38144  >  34568 [ACK] Seq=119337 Ack=1 Win=29696 Len=1448 TSval=1368160 TSecr=1368133"
"124","37.066186185","10.0.0.2","10.0.0.3","TCP","78","[TCP Dup ACK 120#1] 34568  >  38144 [ACK] Seq=1 Ack=119337 Win=168448 Len=0 TSval=1368176 TSecr=1368089 SLE=120785 SRE=129473"
"125","37.114379989","10.0.0.2","10.0.0.3","TCP","66","34568  >  38144 [ACK] Seq=1 Ack=129473 Win=167424 Len=0 TSval=1368188 TSecr=1368160"
"126","37.132084672","10.0.0.3","10.0.0.2","TCP","1514","38144  >  34568 [ACK] Seq=129473 Ack=1 Win=29696 Len=1448 TSval=1368202 TSecr=1368176"
"127","37.144510019","10.0.0.3","10.0.0.2","TCP","1514","38144  >  34568 [ACK] Seq=130921 Ack=1 Win=29696 Len=1448 TSval=1368202 TSecr=1368176"
"128","37.190806932","10.0.0.3","10.0.0.2","TCP","2962","38144  >  34568 [ACK] Seq=132369 Ack=1 Win=29696 Len=2896 TSval=1368214 TSecr=1368188"
"129","37.202907258","10.0.0.3","10.0.0.2","TCP","1514","38144  >  34568 [ACK] Seq=135265 Ack=1 Win=29696 Len=1448 TSval=1368214 TSecr=1368188"
"130","37.302141454","10.0.0.2","10.0.0.3","TCP","66","34568  >  38144 [ACK] Seq=1 Ack=132369 Win=170496 Len=0 TSval=1368235 TSecr=1368202"
"131","37.345601927","10.0.0.2","10.0.0.3","TCP","66","34568  >  38144 [ACK] Seq=1 Ack=135265 Win=170496 Len=0 TSval=1368245 TSecr=1368214"
"132","37.377547423","10.0.0.3","10.0.0.2","TCP","2962","38144  >  34568 [ACK] Seq=136713 Ack=1 Win=29696 Len=2896 TSval=1368261 TSecr=1368235"
"133","37.396834902","10.0.0.2","10.0.0.3","TCP","66","34568  >  38144 [ACK] Seq=1 Ack=136713 Win=170496 Len=0 TSval=1368259 TSecr=1368214"
"134","37.460125053","10.0.0.3","10.0.0.2","TCP","1514","[TCP Previous segment not captured] 38144  >  34568 [ACK] Seq=142505 Ack=1 Win=29696 Len=1448 TSval=1368284 TSecr=1368259"
"135","37.531683453","10.0.0.2","10.0.0.3","TCP","66","34568  >  38144 [ACK] Seq=1 Ack=139609 Win=170496 Len=0 TSval=1368292 TSecr=1368261"
"136","37.608083692","10.0.0.3","10.0.0.2","TCP","2962","38144  >  34568 [ACK] Seq=143953 Ack=1 Win=29696 Len=2896 TSval=1368318 TSecr=1368292"
"137","37.615783875","10.0.0.2","10.0.0.3","TCP","78","[TCP Dup ACK 135#1] 34568  >  38144 [ACK] Seq=1 Ack=139609 Win=170496 Len=0 TSval=1368313 TSecr=1368261 SLE=142505 SRE=143953"
"138","37.679891108","10.0.0.3","10.0.0.2","TCP","1514","38144  >  34568 [ACK] Seq=146849 Ack=1 Win=29696 Len=1448 TSval=1368339 TSecr=1368313"
"139","37.775498547","10.0.0.2","10.0.0.3","TCP","78","[TCP Dup ACK 135#2] 34568  >  38144 [ACK] Seq=1 Ack=139609 Win=170496 Len=0 TSval=1368352 TSecr=1368261 SLE=142505 SRE=146849"
"140","37.836579209","10.0.0.2","10.0.0.3","TCP","78","[TCP Dup ACK 135#3] 34568  >  38144 [ACK] Seq=1 Ack=139609 Win=170496 Len=0 TSval=1368368 TSecr=1368261 SLE=142505 SRE=148297"
"141","37.839869961","10.0.0.3","10.0.0.2","TCP","1514","[TCP Fast Retransmission] 38144  >  34568 [ACK] Seq=139609 Ack=1 Win=29696 Len=1448 TSval=1368379 TSecr=1368352"
"142","37.852702726","10.0.0.3","10.0.0.2","TCP","1514","[TCP Out-Of-Order] 38144  >  34568 [ACK] Seq=141057 Ack=1 Win=29696 Len=1448 TSval=1368379 TSecr=1368352"
"143","37.993210297","10.0.0.2","10.0.0.3","TCP","78","34568  >  38144 [ACK] Seq=1 Ack=141057 Win=169472 Len=0 TSval=1368408 TSecr=1368379 SLE=142505 SRE=148297"
"144","38.005188651","10.0.0.2","10.0.0.3","TCP","66","34568  >  38144 [ACK] Seq=1 Ack=148297 Win=168960 Len=0 TSval=1368411 TSecr=1368379"
"145","38.081038772","10.0.0.3","10.0.0.2","TCP","2962","[TCP Previous segment not captured] 38144  >  34568 [ACK] Seq=151193 Ack=1 Win=29696 Len=2896 TSval=1368436 TSecr=1368411"
"146","38.235384304","10.0.0.2","10.0.0.3","TCP","78","[TCP Window Update] 34568  >  38144 [ACK] Seq=1 Ack=148297 Win=170496 Len=0 TSval=1368468 TSecr=1368379 SLE=151193 SRE=154089"
"147","38.298841324","10.0.0.3","10.0.0.2","TCP","1514","[TCP Retransmission] 38144  >  34568 [ACK] Seq=148297 Ack=1 Win=29696 Len=1448 TSval=1368494 TSecr=1368468"
"148","38.453220233","10.0.0.2","10.0.0.3","TCP","78","34568  >  38144 [ACK] Seq=1 Ack=149745 Win=169472 Len=0 TSval=1368523 TSecr=1368494 SLE=151193 SRE=154089"
"149","38.517089886","10.0.0.3","10.0.0.2","TCP","1514","[TCP Retransmission] 38144  >  34568 [ACK] Seq=149745 Ack=1 Win=29696 Len=1448 TSval=1368548 TSecr=1368523"
"150","38.530132025","10.0.0.3","10.0.0.2","TCP","1514","38144  >  34568 [ACK] Seq=154089 Ack=1 Win=29696 Len=1448 TSval=1368548 TSecr=1368523"
"151","38.669387451","10.0.0.2","10.0.0.3","TCP","66","34568  >  38144 [ACK] Seq=1 Ack=154089 Win=169472 Len=0 TSval=1368577 TSecr=1368548"
"152","38.733377598","10.0.0.3","10.0.0.2","TCP","1514","38144  >  34568 [ACK] Seq=155537 Ack=1 Win=29696 Len=1448 TSval=1368602 TSecr=1368577"
"153","38.733384310","10.0.0.2","10.0.0.3","TCP","66","34568  >  38144 [ACK] Seq=1 Ack=155537 Win=170496 Len=0 TSval=1368593 TSecr=1368548"
"154","38.746170157","10.0.0.3","10.0.0.2","TCP","1514","38144  >  34568 [ACK] Seq=156985 Ack=1 Win=29696 Len=1448 TSval=1368602 TSecr=1368577"
"155","38.795980230","10.0.0.3","10.0.0.2","TCP","1514","38144  >  34568 [ACK] Seq=158433 Ack=1 Win=29696 Len=1448 TSval=1368618 TSecr=1368593"
"156","38.899283272","10.0.0.2","10.0.0.3","TCP","66","34568  >  38144 [ACK] Seq=1 Ack=158433 Win=170496 Len=0 TSval=1368634 TSecr=1368602"
"157","38.968835367","10.0.0.3","10.0.0.2","TCP","1514","38144  >  34568 [ACK] Seq=159881 Ack=1 Win=29696 Len=1448 TSval=1368660 TSecr=1368634"
"158","39.040829019","10.0.0.2","10.0.0.3","TCP","66","34568  >  38144 [ACK] Seq=1 Ack=159881 Win=170496 Len=0 TSval=1368668 TSecr=1368618"
"159","39.103617724","10.0.0.3","10.0.0.2","TCP","1514","[TCP Previous segment not captured] 38144  >  34568 [ACK] Seq=162777 Ack=1 Win=29696 Len=1448 TSval=1368695 TSecr=1368668"
"160","39.258162584","10.0.0.2","10.0.0.3","TCP","78","34568  >  38144 [ACK] Seq=1 Ack=161329 Win=170496 Len=0 TSval=1368724 TSecr=1368660 SLE=162777 SRE=164225"
"161","39.321476353","10.0.0.3","10.0.0.2","TCP","1514","38144  >  34568 [ACK] Seq=164225 Ack=1 Win=29696 Len=1448 TSval=1368750 TSecr=1368724"
"162","39.333770653","10.0.0.3","10.0.0.2","TCP","1514","38144  >  34568 [ACK] Seq=165673 Ack=1 Win=29696 Len=1448 TSval=1368750 TSecr=1368724"
"163","39.473309546","10.0.0.2","10.0.0.3","TCP","78","[TCP Dup ACK 160#1] 34568  >  38144 [ACK] Seq=1 Ack=161329 Win=170496 Len=0 TSval=1368778 TSecr=1368660 SLE=162777 SRE=165673"
"164","39.490681275","10.0.0.2","10.0.0.3","TCP","78","[TCP Dup ACK 160#2] 34568  >  38144 [ACK] Seq=1 Ack=161329 Win=170496 Len=0 TSval=1368781 TSecr=1368660 SLE=162777 SRE=167121"
"165","39.537030362","10.0.0.3","10.0.0.2","TCP","1514","38144  >  34568 [ACK] Seq=167121 Ack=1 Win=29696 Len=1448 TSval=1368803 TSecr=1368778"
"166","39.554173287","10.0.0.3","10.0.0.2","TCP","1514","[TCP Out-Of-Order] 38144  >  34568 [ACK] Seq=161329 Ack=1 Win=29696 Len=1448 TSval=1368808 TSecr=1368781"
"167","39.691297130","10.0.0.2","10.0.0.3","TCP","78","[TCP Dup ACK 160#3] 34568  >  38144 [ACK] Seq=1 Ack=161329 Win=170496 Len=0 TSval=1368832 TSecr=1368660 SLE=162777 SRE=168569"
"168","39.713510828","10.0.0.2","10.0.0.3","TCP","66","34568  >  38144 [ACK] Seq=1 Ack=168569 Win=168960 Len=0 TSval=1368836 TSecr=1368808"
"169","39.755039102","10.0.0.3","10.0.0.2","TCP","1514","38144  >  34568 [ACK] Seq=168569 Ack=1 Win=29696 Len=1448 TSval=1368858 TSecr=1368832"
"170","39.789832275","10.0.0.3","10.0.0.2","TCP","2962","38144  >  34568 [ACK] Seq=170017 Ack=1 Win=29696 Len=2896 TSval=1368863 TSecr=1368836"
"171","39.801844489","10.0.0.3","10.0.0.2","TCP","1514","38144  >  34568 [ACK] Seq=172913 Ack=1 Win=29696 Len=1448 TSval=1368863 TSecr=1368836"
"172","39.944107342","10.0.0.2","10.0.0.3","TCP","66","34568  >  38144 [ACK] Seq=1 Ack=172913 Win=170496 Len=0 TSval=1368896 TSecr=1368858"
"173","40.018722149","10.0.0.3","10.0.0.2","TCP","2962","38144  >  34568 [ACK] Seq=174361 Ack=1 Win=29696 Len=2896 TSval=1368921 TSecr=1368896"
"174","40.044891034","10.0.0.2","10.0.0.3","TCP","66","34568  >  38144 [ACK] Seq=1 Ack=174361 Win=170496 Len=0 TSval=1368919 TSecr=1368863"
"175","40.122921668","10.0.0.3","10.0.0.2","TCP","2962","38144  >  34568 [ACK] Seq=177257 Ack=1 Win=29696 Len=2896 TSval=1368946 TSecr=1368919"
"176","40.179048260","10.0.0.2","10.0.0.3","TCP","66","34568  >  38144 [ACK] Seq=1 Ack=177257 Win=170496 Len=0 TSval=1368953 TSecr=1368921"
"177","40.253653942","10.0.0.3","10.0.0.2","TCP","2962","38144  >  34568 [ACK] Seq=180153 Ack=1 Win=29696 Len=2896 TSval=1368980 TSecr=1368953"
"178","40.281232349","10.0.0.2","10.0.0.3","TCP","66","34568  >  38144 [ACK] Seq=1 Ack=180153 Win=170496 Len=0 TSval=1368980 TSecr=1368946"
"179","40.420795969","10.0.0.2","10.0.0.3","TCP","66","34568  >  38144 [ACK] Seq=1 Ack=183049 Win=170496 Len=0 TSval=1369011 TSecr=1368980"
"180","40.540453312","10.0.0.3","10.0.0.2","TCP","1514","[TCP Previous segment not captured] 38144  >  34568 [ACK] Seq=185945 Ack=1 Win=29696 Len=1448 TSval=1369040 TSecr=1369011"
"181","40.705790775","10.0.0.2","10.0.0.3","TCP","78","[TCP Dup ACK 179#1] 34568  >  38144 [ACK] Seq=1 Ack=183049 Win=170496 Len=0 TSval=1369085 TSecr=1368980 SLE=185945 SRE=187393"
"182","40.782496590","10.0.0.3","10.0.0.2","TCP","2962","38144  >  34568 [ACK] Seq=187393 Ack=1 Win=29696 Len=2896 TSval=1369112 TSecr=1369085"
"183","40.937493683","10.0.0.3","10.0.0.2","TCP","1514","[TCP Out-Of-Order] 38144  >  34568 [ACK] Seq=183049 Ack=1 Win=29696 Len=1448 TSval=1369154 TSecr=1369085"
"184","40.939740664","10.0.0.2","10.0.0.3","TCP","78","[TCP Dup ACK 179#2] 34568  >  38144 [ACK] Seq=1 Ack=183049 Win=170496 Len=0 TSval=1369144 TSecr=1368980 SLE=185945 SRE=190289"
"185","41.003104112","10.0.0.3","10.0.0.2","TCP","1514","[TCP Retransmission] 38144  >  34568 [ACK] Seq=184497 Ack=1 Win=29696 Len=1448 TSval=1369170 TSecr=1369144"
"186","41.093322436","10.0.0.2","10.0.0.3","TCP","78","34568  >  38144 [ACK] Seq=1 Ack=184497 Win=169472 Len=0 TSval=1369182 TSecr=1369154 SLE=185945 SRE=190289"
"187","41.158383350","10.0.0.2","10.0.0.3","TCP","66","34568  >  38144 [ACK] Seq=1 Ack=190289 Win=167936 Len=0 TSval=1369199 TSecr=1369170"
"188","41.282671823","10.0.0.3","10.0.0.2","TCP","2962","[TCP Previous segment not captured] 38144  >  34568 [ACK] Seq=191737 Ack=1 Win=29696 Len=2896 TSval=1369225 TSecr=1369199"
"189","41.305137743","10.0.0.3","10.0.0.2","TCP","1514","38144  >  34568 [ACK] Seq=194633 Ack=1 Win=29696 Len=1448 TSval=1369225 TSecr=1369199"
"190","41.438309006","10.0.0.2","10.0.0.3","TCP","78","[TCP Window Update] 34568  >  38144 [ACK] Seq=1 Ack=190289 Win=170496 Len=0 TSval=1369269 TSecr=1369170 SLE=191737 SRE=194633"
"191","41.461816504","10.0.0.2","10.0.0.3","TCP","78","[TCP Dup ACK 187#1] 34568  >  38144 [ACK] Seq=1 Ack=190289 Win=170496 Len=0 TSval=1369275 TSecr=1369170 SLE=191737 SRE=196081"
"192","41.512841718","10.0.0.3","10.0.0.2","TCP","2962","38144  >  34568 [ACK] Seq=196081 Ack=1 Win=29696 Len=2896 TSval=1369295 TSecr=1369269"
"193","41.525633391","10.0.0.3","10.0.0.2","TCP","1514","[TCP Out-Of-Order] 38144  >  34568 [ACK] Seq=190289 Ack=1 Win=29696 Len=1448 TSval=1369301 TSecr=1369275"
"194","41.666733008","10.0.0.2","10.0.0.3","TCP","78","[TCP Dup ACK 187#2] 34568  >  38144 [ACK] Seq=1 Ack=190289 Win=170496 Len=0 TSval=1369326 TSecr=1369170 SLE=191737 SRE=198977"
"195","41.688529700","10.0.0.2","10.0.0.3","TCP","66","34568  >  38144 [ACK] Seq=1 Ack=198977 Win=166912 Len=0 TSval=1369331 TSecr=1369301"
"196","41.730187743","10.0.0.3","10.0.0.2","TCP","1514","38144  >  34568 [ACK] Seq=198977 Ack=1 Win=29696 Len=1448 TSval=1369352 TSecr=1369326"
"197","41.765293396","10.0.0.3","10.0.0.2","TCP","2962","38144  >  34568 [ACK] Seq=200425 Ack=1 Win=29696 Len=2896 TSval=1369357 TSecr=1369331"
"198","41.788040493","10.0.0.3","10.0.0.2","TCP","2962","38144  >  34568 [ACK] Seq=203321 Ack=1 Win=29696 Len=2896 TSval=1369357 TSecr=1369331"
"199","41.882395643","10.0.0.2","10.0.0.3","TCP","66","34568  >  38144 [ACK] Seq=1 Ack=200425 Win=170496 Len=0 TSval=1369380 TSecr=1369352"
"200","41.920597942","10.0.0.2","10.0.0.3","TCP","66","34568  >  38144 [ACK] Seq=1 Ack=203321 Win=170496 Len=0 TSval=1369389 TSecr=1369357"
"201","41.942933884","10.0.0.2","10.0.0.3","TCP","66","34568  >  38144 [ACK] Seq=1 Ack=206217 Win=170496 Len=0 TSval=1369395 TSecr=1369357"
"202","41.944907009","10.0.0.3","10.0.0.2","TCP","1514","38144  >  34568 [ACK] Seq=206217 Ack=1 Win=29696 Len=1448 TSval=1369406 TSecr=1369380"
"203","41.997487438","10.0.0.3","10.0.0.2","TCP","2962","38144  >  34568 [ACK] Seq=207665 Ack=1 Win=29696 Len=2896 TSval=1369415 TSecr=1369389"
"204","42.020251689","10.0.0.3","10.0.0.2","TCP","2962","38144  >  34568 [ACK] Seq=210561 Ack=1 Win=29696 Len=2896 TSval=1369421 TSecr=1369395"
"205","42.101373868","10.0.0.2","10.0.0.3","TCP","66","34568  >  38144 [ACK] Seq=1 Ack=207665 Win=170496 Len=0 TSval=1369434 TSecr=1369406"
"206","42.225338078","10.0.0.3","10.0.0.2","TCP","1514","38144  >  34568 [ACK] Seq=213457 Ack=1 Win=29696 Len=1448 TSval=1369460 TSecr=1369434"
"207","42.225335926","10.0.0.2","10.0.0.3","TCP","66","34568  >  38144 [ACK] Seq=1 Ack=210561 Win=170496 Len=0 TSval=1369448 TSecr=1369415"
"208","42.225931805","10.0.0.2","10.0.0.3","TCP","66","34568  >  38144 [ACK] Seq=1 Ack=213457 Win=170496 Len=0 TSval=1369453 TSecr=1369421"
"209","42.301385298","10.0.0.3","10.0.0.2","TCP","2962","38144  >  34568 [ACK] Seq=214905 Ack=1 Win=29696 Len=2896 TSval=1369491 TSecr=1369448"
"210","42.325156371","10.0.0.3","10.0.0.2","TCP","2962","38144  >  34568 [ACK] Seq=217801 Ack=1 Win=29696 Len=2896 TSval=1369491 TSecr=1369453"
"211","42.397843667","10.0.0.2","10.0.0.3","TCP","66","34568  >  38144 [ACK] Seq=1 Ack=214905 Win=170496 Len=0 TSval=1369509 TSecr=1369460"
"212","42.455967414","10.0.0.2","10.0.0.3","TCP","66","34568  >  38144 [ACK] Seq=1 Ack=217801 Win=170496 Len=0 TSval=1369523 TSecr=1369491"
"213","42.463659052","10.0.0.3","10.0.0.2","TCP","1514","38144  >  34568 [ACK] Seq=220697 Ack=1 Win=29696 Len=1448 TSval=1369535 TSecr=1369509"
"214","42.477864944","10.0.0.2","10.0.0.3","TCP","66","34568  >  38144 [ACK] Seq=1 Ack=220697 Win=170496 Len=0 TSval=1369529 TSecr=1369491"
"215","42.531589078","10.0.0.3","10.0.0.2","TCP","2962","38144  >  34568 [ACK] Seq=222145 Ack=1 Win=29696 Len=2896 TSval=1369549 TSecr=1369523"
"216","42.626921380","10.0.0.2","10.0.0.3","TCP","66","34568  >  38144 [ACK] Seq=1 Ack=222145 Win=170496 Len=0 TSval=1369566 TSecr=1369535"
"217","42.687266734","10.0.0.2","10.0.0.3","TCP","66","34568  >  38144 [ACK] Seq=1 Ack=225041 Win=170496 Len=0 TSval=1369581 TSecr=1369549"
"218","42.690446774","10.0.0.3","10.0.0.2","TCP","1514","[TCP Previous segment not captured] 38144  >  34568 [ACK] Seq=227937 Ack=1 Win=29696 Len=1448 TSval=1369592 TSecr=1369566"
"219","42.763588496","10.0.0.3","10.0.0.2","TCP","2962","38144  >  34568 [ACK] Seq=229385 Ack=1 Win=29696 Len=2896 TSval=1369607 TSecr=1369581"
"220","42.845853135","10.0.0.2","10.0.0.3","TCP","78","[TCP Dup ACK 217#1] 34568  >  38144 [ACK] Seq=1 Ack=225041 Win=170496 Len=0 TSval=1369621 TSecr=1369549 SLE=227937 SRE=229385"
"221","42.930566569","10.0.0.3","10.0.0.2","TCP","1514","38144  >  34568 [ACK] Seq=232281 Ack=1 Win=29696 Len=1448 TSval=1369646 TSecr=1369621"
"222","42.930596400","10.0.0.2","10.0.0.3","TCP","78","[TCP Dup ACK 217#2] 34568  >  38144 [ACK] Seq=1 Ack=225041 Win=170496 Len=0 TSval=1369639 TSecr=1369549 SLE=227937 SRE=232281"
"223","43.015931926","10.0.0.3","10.0.0.2","TCP","1514","[TCP Out-Of-Order] 38144  >  34568 [ACK] Seq=225041 Ack=1 Win=29696 Len=1448 TSval=1369668 TSecr=1369621"
"224","43.049299892","10.0.0.3","10.0.0.2","TCP","1514","[TCP Out-Of-Order] 38144  >  34568 [ACK] Seq=226489 Ack=1 Win=29696 Len=1448 TSval=1369668 TSecr=1369639"
"225","43.156196982","10.0.0.2","10.0.0.3","TCP","78","[TCP Dup ACK 217#3] 34568  >  38144 [ACK] Seq=1 Ack=225041 Win=170496 Len=0 TSval=1369697 TSecr=1369549 SLE=227937 SRE=233729"
"226","43.210759257","10.0.0.2","10.0.0.3","TCP","78","34568  >  38144 [ACK] Seq=1 Ack=226489 Win=169472 Len=0 TSval=1369711 TSecr=1369668 SLE=227937 SRE=233729"
"227","43.210761802","10.0.0.2","10.0.0.3","TCP","66","34568  >  38144 [ACK] Seq=1 Ack=233729 Win=167936 Len=0 TSval=1369711 TSecr=1369668"
"228","43.219017505","10.0.0.3","10.0.0.2","TCP","1514","38144  >  34568 [ACK] Seq=233729 Ack=1 Win=29696 Len=1448 TSval=1369724 TSecr=1369697"
"229","43.274686356","10.0.0.3","10.0.0.2","TCP","1514","38144  >  34568 [ACK] Seq=235177 Ack=1 Win=29696 Len=1448 TSval=1369738 TSecr=1369711"
"230","43.298112359","10.0.0.3","10.0.0.2","TCP","2962","38144  >  34568 [ACK] Seq=236625 Ack=1 Win=29696 Len=2896 TSval=1369738 TSecr=1369711"
"231","43.415835372","10.0.0.2","10.0.0.3","TCP","66","34568  >  38144 [ACK] Seq=1 Ack=235177 Win=170496 Len=0 TSval=1369763 TSecr=1369724"
"232","43.457225239","10.0.0.2","10.0.0.3","TCP","66","34568  >  38144 [ACK] Seq=1 Ack=239521 Win=170496 Len=0 TSval=1369773 TSecr=1369738"
"233","43.479156286","10.0.0.3","10.0.0.2","TCP","1514","38144  >  34568 [ACK] Seq=239521 Ack=1 Win=29696 Len=1448 TSval=1369789 TSecr=1369763"
"234","43.534128373","10.0.0.3","10.0.0.2","TCP","2962","38144  >  34568 [ACK] Seq=240969 Ack=1 Win=29696 Len=2896 TSval=1369799 TSecr=1369773"
"235","43.561465818","10.0.0.3","10.0.0.2","TCP","2962","38144  >  34568 [ACK] Seq=243865 Ack=1 Win=29696 Len=2896 TSval=1369799 TSecr=1369773"
"236","43.689706422","10.0.0.2","10.0.0.3","TCP","66","34568  >  38144 [ACK] Seq=1 Ack=243865 Win=170496 Len=0 TSval=1369831 TSecr=1369789"
"237","43.715799533","10.0.0.2","10.0.0.3","TCP","66","34568  >  38144 [ACK] Seq=1 Ack=246761 Win=170496 Len=0 TSval=1369838 TSecr=1369799"
"238","43.767183179","10.0.0.3","10.0.0.2","TCP","2962","38144  >  34568 [ACK] Seq=246761 Ack=1 Win=29696 Len=2896 TSval=1369857 TSecr=1369831"
"239","43.792646674","10.0.0.3","10.0.0.2","TCP","2962","38144  >  34568 [ACK] Seq=249657 Ack=1 Win=29696 Len=2896 TSval=1369864 TSecr=1369838"
"240","43.802973485","10.0.0.3","10.0.0.2","TCP","1514","38144  >  34568 [ACK] Seq=252553 Ack=1 Win=29696 Len=1448 TSval=1369864 TSecr=1369838"
"241","43.918968132","10.0.0.2","10.0.0.3","TCP","66","34568  >  38144 [ACK] Seq=1 Ack=249657 Win=170496 Len=0 TSval=1369889 TSecr=1369857"
"242","43.945868963","10.0.0.2","10.0.0.3","TCP","66","34568  >  38144 [ACK] Seq=1 Ack=252553 Win=170496 Len=0 TSval=1369896 TSecr=1369864"
"243","43.993868311","10.0.0.3","10.0.0.2","TCP","2962","38144  >  34568 [ACK] Seq=254001 Ack=1 Win=29696 Len=2896 TSval=1369915 TSecr=1369889"
"244","44.014003307","10.0.0.2","10.0.0.3","TCP","66","34568  >  38144 [ACK] Seq=1 Ack=254001 Win=170496 Len=0 TSval=1369913 TSecr=1369864"
"245","44.023489651","10.0.0.3","10.0.0.2","TCP","2962","38144  >  34568 [ACK] Seq=256897 Ack=1 Win=29696 Len=2896 TSval=1369922 TSecr=1369896"
"246","44.078911625","10.0.0.3","10.0.0.2","TCP","1514","38144  >  34568 [ACK] Seq=259793 Ack=1 Win=29696 Len=1448 TSval=1369939 TSecr=1369913"
"247","44.154640759","10.0.0.2","10.0.0.3","TCP","66","34568  >  38144 [ACK] Seq=1 Ack=256897 Win=170496 Len=0 TSval=1369948 TSecr=1369915"
"248","44.175998581","10.0.0.2","10.0.0.3","TCP","66","34568  >  38144 [ACK] Seq=1 Ack=259793 Win=170496 Len=0 TSval=1369954 TSecr=1369922"
"249","44.229486673","10.0.0.3","10.0.0.2","TCP","2962","38144  >  34568 [ACK] Seq=261241 Ack=1 Win=29696 Len=2896 TSval=1369974 TSecr=1369948"
"250","44.253732785","10.0.0.3","10.0.0.2","TCP","2962","38144  >  34568 [ACK] Seq=264137 Ack=1 Win=29696 Len=2896 TSval=1369979 TSecr=1369954"
"251","44.334711552","10.0.0.2","10.0.0.3","TCP","66","34568  >  38144 [ACK] Seq=1 Ack=261241 Win=170496 Len=0 TSval=1369991 TSecr=1369939"
"252","44.385875205","10.0.0.2","10.0.0.3","TCP","66","34568  >  38144 [ACK] Seq=1 Ack=264137 Win=170496 Len=0 TSval=1370006 TSecr=1369974"
"253","44.397482747","10.0.0.3","10.0.0.2","TCP","1514","38144  >  34568 [ACK] Seq=267033 Ack=1 Win=29696 Len=1448 TSval=1370019 TSecr=1369991"
"254","44.406701617","10.0.0.2","10.0.0.3","TCP","66","34568  >  38144 [ACK] Seq=1 Ack=267033 Win=170496 Len=0 TSval=1370011 TSecr=1369979"
"255","44.475810302","10.0.0.3","10.0.0.2","TCP","2962","38144  >  34568 [ACK] Seq=268481 Ack=1 Win=29696 Len=2896 TSval=1370032 TSecr=1370006"
"256","44.486201044","10.0.0.3","10.0.0.2","TCP","2962","38144  >  34568 [ACK] Seq=271377 Ack=1 Win=29696 Len=2896 TSval=1370037 TSecr=1370011"
"257","44.501739812","10.0.0.3","10.0.0.2","TCP","1514","38144  >  34568 [ACK] Seq=274273 Ack=1 Win=29696 Len=1448 TSval=1370037 TSecr=1370011"
"258","44.637202871","10.0.0.2","10.0.0.3","TCP","66","34568  >  38144 [ACK] Seq=1 Ack=271377 Win=170496 Len=0 TSval=1370069 TSecr=1370019"
